Number,Sentence
1930,최근/NNG 별세__01/NNG 하/XSV ᆫ/ETM 김영덕/NNP 전__08/MM 서울은행장/NNG 상가__09/NNG 에서/JKB 오가/VV ᆫ/ETM 얘기/NNG 이/VCP 다/EF ./SF
1931,그녀/NP 는/JX 동굴/NNG 에서/JKB 비__01/NNG 를/JKO 긋__01/VV 고/EC 있/VX 었/EP 다/EF ./SF
1932,결혼/NNG 에서/JKB 는/JX 여성__01/NNG 이/JKS 모성__01/NNG 이/JKC 되__01/VV ᆫ다/EF ./SF
1933,방__07/NNG 안__01/NNG 에서/JKB 는/JX 사람/NNG 이/JKS 앓/VV 고/EC 있/VX 었/EP 습니다/EF ./SF
1934,삭풍/NNG 속__01/NNG 에서/JKB 도/JX 봄/NNG 을/JKO 노래__01/NNG 하/XSV 는/ETM 새소리/NNG 를/JKO 듣__01/VV 는다/EF ./SF
1935,그중/NNG 7/SN 명/NNB 은/JX 폭풍__01/NNG 속__01/NNG 에서/JKB 교통사고/NNG 로/JKB 숨지/VV 었/EP 다/EF ./SF
1936,학교/NNG 에서/JKB 는/JX 내내/MAG 거짓말/NNG 을/JKO 가르치__01/VV 었/EP 다/EF ./SF
1937,집__01/NNG 에서/JKB 일요일/NNG 밤__01/NNG 의/JKG 대/XPN 행진__02/NNG '/SS 을/JKO 보/VV 았/EP 다/EF ./SF
1938,이/MM 방__07/NNG 에서/JKB 성진이/NNP 오빠/NNG 하고/JKB 함께/MAG 자__01/VV ᆯ/ETM 것/NNB 이/VCP 오/EF ./SF
1939,이/MM 그림__01/NNG 에서/JKB 는/JX 앞/NNG 으로/JKB 어떤/MM 사건__01/NNG 이/JKS 일어나/VV ᆯ까/EF ?/SF
1940,당신/NP 의/JKG 슬픔/NNG 이/JKS 어디/NP 에서/JKB 나오/VV 는/ETM 것/NNB 이/VCP ᆫ데요/EF ?/SF "/SS
1941,이__05/MM 긴장/NNG 되/XSV ᆫ/ETM 상상__07/NNG 체험/NNG 속__01/NNG 에서/JKB 아이__01/NNG 들/XSN 의/JKG 키__01/NNG 가/JKS 자라나/VV ᆫ다/EF ./SF
1942,시리즈/NNG 대회__02/NNG 에서/JKB 두/MM 번/NNB 우승__05/NNG 하/XSV 면/EC 자동__01/NNG 으로/JKB 왕중왕전/NNG 출전__02/NNG 자격__04/NNG 이/JKS 주어지/VV ᆫ다/EF ./SF
1943,그리고/MAJ 그/NP 의/JKG 대답/NNG 에서/JKB 나름/NNB 대로/JX 행복__02/NNG 을/JKO 찾/VV 곤/EC 하/VX 았/EP 다/EF ./SF
1944,시스템/NNG 에서/JKB 고객__04/NNG 명단__01/NNG 을/JKO 뽑/VV 아/EC 보/VX ᆯ게요/EF ./SF "/SS
1945,태내/NNG 에서/JKB 아기__01/NNG 가/JKS 자라__01/VV 는/ETM 성장력/NNG 은/JX 인간__01/NNG 의/JKG 상상/NNG 을/JKO 초월__02/NNG 하/XSV ᆫ다/EF ./SF
1946,=/SW 7/SN 차/NNB 장관__02/NNG 급__04/NNG 회담/NNG 에서/JKB 논의__02/NNG 하/XSV 게/EC 되__01/VV ᆫ다/EF ./SF
1947,그/MM 아파트/NNG 는/JX 우리/NP 시내__03/NNG 에서/JKB 처음/NNG 생기/VV ᆫ/ETM 고층/NNG 아파트/NNG 이/VCP 야/EF ./SF
1948,그런/MM 여자__02/NNG 의/JKG 입/NNG 에서/JKB 처음/NNG 나오/VV ᆫ/ETM 말__01/NNG ./SF
1949,방이동/NNP 올림픽/NNG 선수__05/NNG -/SS 기자촌/NNG 아파트/NNG 주민/NNG 들/XSN 역시/MAG 노인정/NNG 에서/JKB 요가__02/NNG 를/JKO 배우__01/VV ᆫ다/EF ./SF
1950,</SS 그래픽/NNG >/SS 하반기/NNG 기업__01/NNG 경영__02/NNG 에서/JKB 가장__01/MAG 어렵/VA ᆫ/ETM 점__10/NNG 은/JX ?/SF
1951,결승전/NNG 은/JX 30/SN 일/NNB 일본/NNP 요코하마/NNP 에서/JKB 열리__02/VV ᆫ다/EF ./SF
1952,"/SS 한마디/NNG 로/JKB 콘도/NNG 에서/JKB 살__01/VV 는/ETM 기분__01/NNG 이/VCP 지요/EF ./SF
1953,5/SN 월/NNB 은/JX 부풀/VV ᆫ/ETM 희망/NNG 속__01/NNG 에서/JKB 일__01/NNG 하/XSV 기/ETN 때문/NNB 이/VCP 다/EF ./SF
1954,옆/NNG 에서/JKB 다른/MM 사람/NNG 들/XSN 이/JKS "/SS 야/IC ,/SP 말리__02/VV 어/EF !/SF "/SS
1955,사단__05/NNG 법인__02/NNG 한국교사휴양원/NNP 에서/JKB 운영__03/NNG 하/XSV 는/ETM 휴양원/NNG 맞__01/VV 습니까/EF ?/SF
1956,어느새/MAG 아빠/NNG 가/JKS 뒤__01/NNG 에서/JKB 묻__03/VV 으시/EP 었/EP 습니다/EF ./SF
1957,구릉/NNG 에서/JKB 동남쪽/NNG 으로/JKB 경사지/VV ᆫ/ETM 곳__01/NNG 에/JKB 위치__01/NNG 하/XSV 고/EC 있/VX 다/EF ./SF
1958,부모__01/NNG 님/XSN 을/JKO 그리__02/VV 며/EC 서울/NNP 에서/JKB 맏/XPN 딸__01/NNG 현희/NNP 올림__01/NNG ./SF
1959,그/MM 산__01/NNG 아랫마을/NNG 에서/JKB 열여섯/NR 살/NNB 때__01/NNG 나/NP 는/JX 신애/NNP 누나/NNG 를/JKO 처음/NNG 만나/VV 았/EP 다/EF ./SF
1960,은주/NNP 씨/NNB 가/JKS 곁/NNG 에서/JKB 물끄러미/MAG 지켜보/VV 고/EC 있/VX 었/EP 다/EF ./SF
1961,일__01/NNG 꾼/XSN 들/XSN 은/JX 아침/NNG 을/JKO 일__01/NNG 하/XSV ᆯ/ETM 집__01/NNG 에서/JKB 먹__02/VV 는다/EF ./SF
1962,아버지/NNG 의/JKG 말__01/NNG 소리__01/NNG 가/JKS 옆/NNG 에서/JKB 들리__03/VV 는/ETM 듯/NNB 하/XSV 았/EP 다/EF ./SF
1963,"/SS 이__05/MM 세상__01/NNG 에서/JKB 제/XPN 일/NR 좋/VA 은/ETM 것/NNB 이/JKS 뭐/NP 이/VCP 게/EF ?/SF "/SS
1964,"/SS …/SE …/SE 저쪽/NP 에서/JKB 신경질/NNG 나/VV 겠/EP 어/EF ./SF
1965,나/NP 는/JX 거기/NP 에서/JKB 아비__01/NNG 와/JC 어미__01/NNG 의/JKG 냄새/NNG 를/JKO 맡__02/VV 았/EP 다/EF ./SF
1966,마을__01/NNG 에서/JKB 도/JX 딸부자/NNG 이/VCP 라는/ETM 소리__01/NNG 를/JKO 하/VV 았/EP 다/EF ./SF
1967,지금쯤/NNG 교직__04/NNG 에서/JKB 은퇴/NNG 하/XSV 시/EP 어서/EC 어디/NP 서/JKB 살__01/VV 고/EC 계시/VX 는지/EF ./SF
1968,"/SS 잔칫집/NNG 에서/JKB 일__01/NNG 하/XSV 느라/EC 목__01/NNG 이/JKS 쉬__02/VV 었/EP 단다/EF ./SF "/SS
1969,현/NNP 은/JX 더욱/MAG 가슴__01/NNG 속__01/NNG 에서/JKB 만/JX 끓/VV 는다/EF ./SF
1970,그런데/MAJ 우리나라/NNG 에서/JKB ᆫ/JX 동업/NNG 이/VCP 다/EC 싶/VX 으면/EC 으레/MAG 칼부림/NNG 으로/JKB 끝/NNG 을/JKO 맺/VV 는다/EF ./SF
1971,내/NP 김/NNP 서방__02/NNG 시절__01/NNG 에/JKB 절__01/NNG 에서/JKB 듣__01/VV 었/EP 던/ETM 범종__02/NNG 소리__01/NNG 이/VCP 다/EF ./SF
1972,걔/NP 가/JKS 이번__01/NNG 에/JKB 반__11/NNG 에서/JKB 무엇/NP ᆯ/JKO 좀/MAG 하/VV 는가/EC 보/VX 아요/EF ./SF
1973,정신__12/NNG 과/JC 사회생활/NNG 전면__01/NNG 에서/JKB 그렇/VA 다/EF ./SF
1974,자기/NP 가/JKS 세상__01/NNG 에서/JKB 제/XPN 일/NR 똑똑/XR 하/XSA ᆫ/ETM 줄__04/NNB 알/VV 고/EC 있/VX 다니까/EF ./SF
1975,작가__01/NNG 는/JX 이/MM 문학사__02/NNG 적/XSN 문맥__01/NNG 에서/JKB 아무/NP 도/JX 자유__03/NNG 롭/XSA ᆯ/ETM 수__02/NNB 없/VA 다/EF ./SF
1976,[/SS 그림__01/NNG 3/SN ]/SS 은/JX 인간__01/NNG 대뇌/NNG 를/JKO 좌측/NNG 에서/JKB 보__01/VV ᆫ/ETM 것/NNB 이/VCP 다/EF ./SF
1977,작업과/NNG 에서/JKB ᆫ/JX 각/MM 노역장/NNG 마다/JX 샌드백/NNG 하나/NR 를/JKO 달__03/VV 아/EC 주/VX 었/EP 다/EF ./SF
1978,그리고/MAJ 인간__01/NNG 은/JX 그/MM 승부__03/NNG 에서/JKB 항상/MAG 이기__01/VV 는/ETM 것/NNB 만/JX 도/JX 아니/VCN 었/EP 다/EF ./SF
1979,그/NP 는/JX 저수지/NNG 에서/JKB 낚시/NNG 질/XSN 을/JKO 하/VV 고/EC 있/VX 었/EP 다/EF ./SF
1980,글쓰기/NNG 에서/JKB 도/JX 독특/NNG 하/XSA ᆫ/ETM 새롭/VA ᆫ/ETM 관점__02/NNG 이/JKS 절실히/MAG 요구__03/NNG 되/XSV ᆫ다/EF ./SF
1981,그런/MM 상황__02/NNG 에서/JKB 도/JX 그/MM 여자__02/NNG 들/XSN 은/JX 집__01/NNG 에/JKB 는/JX 알리/VV 지/EC 않/VX 았/EP 다/EF ./SF
1982,그때/NNG 윤지/NNP 의/JKG 아득/XR 하/XSA 던/ETM 눈빛__01/NNG 에서/JKB 왜/MAG 영모/NNP 를/JKO 느끼__02/VV 지/EC 못하/VX 았/EP 을까/EF ./SF
1983,38/SN 선__14/NNG 언저리/NNG 에서/JKB 전투/NNG 가/JKS 심하/VA 았/EP 지요/EF ./SF
1984,한적/XR 하/XSA ᆫ/ETM 시골집/NNG 의/JKG 때__02/NNG 절__01/VV 은/ETM 봉창__06/NNG 밖/NNG 에서/JKB 이/VCP 었/EP 습니다/EF ./SF
1985,남만/NNP 도래품/NNG 중__04/NNB 에서/JKB 가장__01/MAG 영향력/NNG 이/JKS 크/VA 었/EP 던/ETM 것/NNB 은/JX 조총__03/NNG 이/VCP 었/EP 다/EF ./SF
1986,2/SN )/SS 조선/NNP 시대__02/NNG 에/JKB 나라/NNG 에서/JKB 치르/VV 던/ETM 상례__07/NNG ./SF
1987,전쟁터/NNG 에서/JKB 나/JX 있/VV 어야/EC 하/VX ᆯ/ETM 병사__02/NNG 들/XSN 끼리/XSN 의/JKG 투쟁/NNG 으로/JKB ./SF
1988,남해안/NNP 에서/JKB 도/JX 특히/MAG 거제도/NNP 에/JKB 몽돌/NNG 해수욕장/NNG 이/JKS 많/VA 다/EF ./SF
1989,오히려/MAJ 무진/NNP 에서/JKB 의/JKG 나/NP 는/JX 항상/MAG 처박히/VV 어/EC 있/VX 는/ETM 상태__01/NNG 이/VCP 었/EP 다/EF ./SF
1990,봉사__03/NNG 활동__02/NNG 에서/JKB 만족__01/NNG 을/JKO 느끼__02/VV 시/EP 어요/EF ./SF
1991,나/NP 는/JX 논__01/NNG 에서/JKB 오빠/NNG 랑/JKB 놀/VV 았/EP 다/EF ./SF
1992,이__05/MM 상년__01/NNG 아/JKV ,/SP 아홉/NR 시/NNB 까지/JX 이태원/NNP 바닥__01/NNG 에서/JKB 뭐/NP 하/VV 았/EP 어/EF ?/SF
1993,그러나/MAJ 인간__01/NNG 세상__01/NNG 에서/JKB 그/MM 누구/NP 가/JKS 장담__02/NNG 하/XSV ᆯ/ETM 수__02/NNB 있/VV 단/ETM 말__01/NNG 이/VCP ᆫ가/EF !/SF
1994,하지만/MAJ ,/SP 우리/NP 나라/NNG 에서/JKB 는/JX 아직/MAG 공식__01/NNG 적/XSN 이/VCP ᆫ/ETM 입장__04/NNG 이/JKS 없/VA 는/ETM 편__04/NNB ./SF
1995,그/MM 사이__01/NNG 에서/JKB 살아남/VV 는/ETM 것/NNB 은/JX 요란/NNG 스럽/XSA ᆫ/ETM 광고__02/NNG 뿐/JX 이/VCP 다/EF ./SF
1996,아이__01/NNG 들/XSN 은/JX 그/MM 행렬/NNG 속__01/NNG 에서/JKB 무엇/NP 을/JKO 느끼__02/VV ᆯ까/EF ./SF
1997,나/NP 는/JX 문__05/NNG 앞/NNG 에서/JKB 잠시/MAG 되돌아서/VV 었/EP 다/EF ./SF
1998,나/NP 는/JX 우영/NNP 의/JKG 손__01/NNG 에서/JKB 시체__02/NNG 의/JKG 다리__01/NNG 를/JKO 내려놓/VV 았/EP 습니다/EF ./SF
1999,셋째/NR ,/SP 수입국/NNG 에서/JKB 공매__01/NNG 하/XSV ᆯ/ETM 수__02/NNB 있/VV 다/EF ./SF
2000,희랍/NNP 비극/NNG 에서/JKB 아가멤논/NNP 은/JX 트로이/NNP 공격__02/NNG 에/JKB 나서/VV ᆫ/ETM 희랍군/NNG 의/JKG 대장__04/NNG 이/VCP 다/EF ./SF
2001,이/MM 도시__03/NNG 출신/NNG 의/JKG 기자__05/NNG 중__04/NNB 에서/JKB 제/XPN 일/NR 독하/VA ᆫ/ETM 기자__05/NNG 이/VCP 었/EP 다/EF ./SF
2002,"/SS 흰둥/NNP 아/JKV ,/SP 내일/NNG 산속/NNG 에서/JKB 만나/VV 자/EF ./SF
2003,현실__02/NNG 의/JKG 중압/NNG 에서/JKB 도피__02/NNG 하/XSV 려는/ETM 심리__01/NNG 도/JX 같/VA 다/EF ./SF
2004,직원__03/NNG 들/XSN 은/JX 뒷전__01/NNG 에서/JKB 구경__01/NNG 만/JX 하/VV 았/EP 다/EF ./SF
2005,사람/NNG 속__01/NNG 에서/JKB 나오/VV 는/ETM 논리/NNG 나/JC 철학/NNG ,/SP 정책__02/NNG 이/JKS 느끼/XR 하/XSA 다/EF ./SF
2006,강렬/XR 하/XSA 고/EC 붉은색/NNG 이/JKS 조금__01/NNG 씩/XSN 그녀/NP 의/JKG 눈앞/NNG 에서/JKB 올라오/VV ᆫ다/EF ./SF
2007,앞/NNG 에서/JKB 다시/MAG 찾/VV 는/ETM 수__02/NNB 밖에/JX ./SF
2008,마당/NNG 에서/JKB 아이__01/NNG 하나/NR 가/JKS 울__01/VV 고/EC 있/VX 었/EP 다/EF ./SF
2009,아버지/NNG 옆/NNG 에서/JKB 는/JX 언제나/MAG 숨__01/NNG 을/JKO 죽이__01/VV 어야/EC 만/JX 하/VX 았/EP 다/EF ./SF
2010,그/MM 상황__02/NNG 에서/JKB 그/MM 사람/NNG 의/JKG 인상__01/NNG 은/JX 괴물/NNG 처럼/JKB 보이__01/VV 었/EP 다/EF ./SF
2011,엑스포/NNG 조직/NNG 위원회/NNG 에서/JKB 는/JX 엑스포/NNG 타운/NNG 아파트/NNG 를/JKO 적극/NNG 권하/VV 고/EC 있/VX 다/EF ./SF
2012,꿈속/NNG 에서/JKB ,/SP 나/NP 는/JX 그/MM 축대/NNG 앞/NNG 에/JKB 서/VV 어/EC 있/VX 었/EP 다/EF ./SF
2013,당시__02/NNG 군내__02/NNG 일각__01/NNG 에서/JKB 는/JX 친위/NNG 쿠데타설/NNG 까지/JX 나오/VV 던/ETM 때__01/NNG 이/VCP 었/EP 다/EF ./SF
2014,나/NP 의/JKG 얼굴/NNG 에서/JKB 는/JX 피__02/NNG 가/JKS 나/VV 았/EP 다/EF ./SF
2015,중앙/NNG 집중__02/NNG 사회__07/NNG 에서/JKB 섣부르/VA ᆫ/ETM 다양/NNG 성/XSN 은/JX 용납/NNG 되/XSV 지/EC 않/VX 는다/EF ./SF
2016,한국/NNP 에서/JKB 오/VV ᆫ/ETM 최/NNP 이/VCP 라는/ETM 사람/NNG 이/VCP ᄇ니다/EF ./SF
2017,여러/MM 가지/NNB 측면/NNG 에서/JKB 해결책/NNG 이/JKS 제시__02/NNG 되/XSV ᆯ/ETM 수__02/NNB 있/VV 을/ETM 것/NNB 이/VCP 다/EF ./SF
2018,전시장/NNG 에서/JKB 는/JX 주문__04/NNG 판매/NNG 도/JX 하/VV ᆫ다/EF ./SF
2019,회색__01/NNG 도시__03/NNG 에서/JKB 태어나/VV ᆫ/ETM 우리/NP 2/SN 세__07/NNB 들/XSN 의/JKG 고향__02/NNG 은/JX 어디/NP 이/VCP ᆯ까/EF ./SF
2020,"/SS 중__88/NNG 1/SN 에서/JKB 고3/NNG 까지/JX 교과서/NNG 이/VCP 라는/ETM 교과서/NNG 는/JX 다시/MAG 보/VV 아라/EF ./SF
2021,다음__01/NNG 교섭/NNG 은/JX 13/SN 일/NNB 대구/NNP 에서/JKB 열리__02/VV ᆫ다/EF ./SF
2022,이웃/NNG 에서/JKB 도/JX 모두/MAG 맛보/VV 았/EP 다/EF ./SF
2023,변화/NNG 의/JKG 시대__02/NNG ,/SP 사람/NNG 들/XSN 은/JX 복고__01/NNG 풍/XSN 에서/JKB 안정감__01/NNG 을/JKO 찾/VV 습니다/EF ./SF
2024,심리학/NNG 에서/JKB 는/JX 무/XPN 의식__03/NNG 을/JKO 우리/NP 마음속/NNG 의/JKG 보물__04/NNG 창고__01/NNG 이/VCP 라고/EC 도/JX 하/VV ᆫ다/EF ./SF
2025,이/MM 집__01/NNG 에서/JKB 는/JX 기꺼이/MAG 기와__01/NNG 를/JKO 바꾸__01/VV 어/EC 가/VX 도록/EC 하/VX 았/EP 다/EF ./SF
2026,관악산/NNP 에서/JKB 는/JX 우점__03/NNG 적/XSN 으로/JKB 흔하/VA 게/EC 번식/NNG 하/XSV ᆯ/ETM 것/NNB 이/VCP 다/EF ./SF
2027,한/MM 시간__04/NNG 은/JX 태권도/NNG 한/MM 시간__04/NNG 은/JX 헬스클럽/NNG 에서/JKB 몸__01/NNG 을/JKO 다듬/VV 는다/EF ./SF
2028,담보__03/NNG 가/JKS 없/VA 는/ETM 상황__02/NNG 에서/JKB 은행__02/NNG 자금__08/NNG 은/JX 그림__01/NNG 의/JKG 떡__01/NNG 이/VCP 었/EP 다/EF ./SF
2029,철봉/NNG 에서/JKB 도/JX 재미__01/NNG 가/JKS 있/VV 었/EP 습니다/EF ./SF
2030,동수/NNP 는/JX 개울가/NNG 샘터/NNG 에서/JKB 물__01/NNG 을/JKO 물통__02/NNG 에/JKB 가득/MAG 채우__03/VV 었/EP 습니다/EF ./SF
2031,이__05/MM 세상__01/NNG 에서/JKB 제/XPN 일/NR 맛있/VA 는/ETM 포도__06/NNG 이/VCP 지/EF !/SF "/SS
2032,운영부/NNG 내/NNB 에서/JKB 는/JX 그래도/MAJ 조/NNP 차장/NNG 만하/XSA ᆫ/ETM 정보통/NNG 이/JKS 없/VA 었/EP 다/EF ./SF
2033,어쨌든/MAG 클레이/NNP 는/JX 사각__04/NNG 의/JKG 정글/NNG 속__01/NNG 에서/JKB 곰__03/NNG 사냥/NNG 을/JKO 하/VV 았/EP 다/EF ./SF
2034,"/SS 언제/NP 까지/JX 여관__03/NNG 에서/JKB 자__01/VV ᆯ/ETM 거/NNB 이/VCP 야/EF ?/SF "/SS
2035,양쪽/NNG 에서/JKB 다/MAG 같이/MAG 반응/NNG 이/JKS 있/VV 어야지/EF ./SF
2036,살포시/MAG 뒤__01/NNG 에서/JKB 껴안/VV 는/ETM 기분__01/NNG 이/VCP 었/EP 다/EF ./SF
2037,바그다드/NNP 역__14/NNG 에서/JKB 우리/NP 는/JX 일반__02/NNG 객차/NNG 의/JKG 좌석/NNG 을/JKO 배정__02/NNG 받__01/VV 았/EP 다/EF ./SF
2038,이종욱/NNP 서강대/NNP 사학__01/NNG 과__04/NNG 교수__06/NNG 는/JX 학__03/NNG 계/XSN 에서/JKB '/SS 이단아/NNG '/SS 로/JKB 불리__04/VV ᆫ다/EF ./SF
2039,누구/NP 가/JKS 알/VV 아/EF ?/SF 혹시__01/MAG 천당/NNG 에서/JKB 다른/MM 여자__02/NNG 랑/JKB 결혼/NNG 하/XSV 았/EP 는지/EF ./SF
2040,그래서/MAJ 매일/MAG 아침/NNG 노량진/NNP 수산__03/NNG 시장__04/NNG 에서/JKB 새벽__01/NNG 장__28/NNG 을/JKO 보__01/VV 아/EC 오/VX ᆫ다/EF ./SF
2041,"/SS 이/MM 마을__01/NNG 에서/JKB 는/JX 다/MAG 살__01/VV 았/EP 으니까/EF ./SF "/SS
2042,"/SS 쓸쓸/XR 하/XSA ᆫ/ETM 병실__02/NNG 에서/JKB 얼마나/MAG 애로__03/NNG 가/JKS 많/VA 으시/EP ᄇ니까/EF ?/SF "/SS
2043,영국/NNP 학교/NNG 에서/JKB 는/JX 현장__03/NNG 학습/NNG 이/JKS 많/VA 다/EF ./SF
2044,이/MM 증세/NNG 는/JX 이/NP 이/VCP 어/EC 미국/NNP 에서/JKB 나타나/VV 았/EP 다/EF ./SF
2045,여기/NP 에서/JKB 또/MAG 한/MM 번/NNB 의/JKG 자기/NP 모순/NNG 을/JKO 겪/VV 게/EC 마련/NNB 이/VCP 다/EF ./SF
2046,학교/NNG 에서/JKB 는/JX 말레이어/NNP 를/JKO 국어/NNG 로/JKB 가르치__01/VV 었/EP 다/EF ./SF
2047,중앙일보/NNP 에서/JKB 는/JX 우리/NP 가/JKS 재현이/NNP 네/XSN 하고/JKB 똑같이/MAG 차리/VV ᆫ다/EF ./SF
2048,물론/MAG 이것/NP 은/JX 李/SH 비서관/NNG 차원__01/NNG 에서/JKB 이루어지/VV ᆯ/ETM 문제__06/NNG 가/JKC 아니/VCN 다/EF ./SF
2049,교통편/NNG :/SP 광주/NNP 지역__03/NNG 시내버스/NNG 로/JKB 광주고/NNP 앞/NNG 에서/JKB 내리/VV ᆫ다/EF ./SF
2050,원래__01/NNG 물속/NNG 에서/JKB 도/JX 멀쩡/XR 하/XSA ᆫ/ETM 가발__02/NNG 은/JX 없/VA 다/EF ./SF
2051,현관__01/NNG 문__05/NNG 앞/NNG 에서/JKB 품이/NNP 는/JX 소리치/VV 었/EP 습니다/EF ./SF
2052,배구__06/NNG 에서/JKB 5/SN 세트/NNG 서브/NNG 권/XSN 은/JX 언제/NP 부터/JX 없/VA 어/EC 지/VX 었/EP 을까/EF ?/SF
2053,(/SS C/SL )/SS 도식__06/NNG 에서/JKB 끝/NNG 으로/JKB 토__03/NNG 를/JKO 하나/NR 달__03/VV 아/EC 두/VX 고/EC 싶/VX 습니다/EF ./SF
2054,환자__03/NNG 는/JX 아직/MAG 혼수/NNG 상태__01/NNG 에서/JKB 깨어나/VV 지/EC 못하/VX 고/EC 있/VX 다/EF ./SF
2055,교문__01/NNG 에서/JKB 붙잡히/VV 지/EC 않/VX 는/ETM 한__06/NNG ./SF "/SS
2056,주지__11/NNG 하/XSV 다시피/EC 발전__01/NNG 의/JKG 세계__02/NNG 에서/JKB 휴식__02/NNG 이란/JX 없/VA 다/EF ./SF
2057,내/NP 가/JKS 그대/NP 를/JKO 죄__03/NNG 속__01/NNG 에서/JKB 만나/VV 고/EC
2058,"/SS 전쟁/NNG 후__08/NNG 북/NNP 에서/JKB 살__01/VV 았/EP 습니다/EF ./SF
2059,동조__03/NNG 회로/NNG 에서/JKB 얻/VV 은/ETM 고/XPN 주파/NNG 신호__01/NNG 는/JX 고/XPN 주파/NNG 전류/NNG 이/VCP 다/EF ./SF
2060,저/NP 는/JX 중학교/NNG ,/SP 고등학교/NNG ,/SP 대학교/NNG 에서/JKB 학생/NNG 들/XSN 을/JKO 가르치__01/VV 었/EP 으며/EC ,/SP 공립학교/NNG ./SF
2061,그러나/MAJ 쿠바/NNP 에서/JKB 는/JX 그것/NP 을/JKO 느끼__02/VV 지/EC 못하/VX 았었/EP 다/EF ./SF
2062,노마/NNP 와/JC 동생__01/NNG 은/JX 마루__03/NNG 에서/JKB 텔레비젼/NNG 을/JKO 보__01/VV 고/EC 있/VX 었/EP 다/EF ./SF
2063,우리/NP 나라/NNG 에서/JKB 는/JX 주로/MAG 육상__02/NNG 과/JC 자전거/NNG 경기__11/NNG 용어__02/NNG 로/JKB 쓰이__03/VV ᆫ다/EF ./SF
2064,책상머리/NNG 에서/JKB 생각__01/NNG 하/XSV 던/ETM 바__03/NNB 와/JKB 는/JX 너무나/MAG 현실__02/NNG 이/JKS 무서움/NNG 을/JKO 깨닫/VV 았/EP 다/EF ./SF
2065,그때/NNG ,/SP 골짜기__01/NNG 건너편/NNG 에서/JKB 굴뚝새/NNG 한/MM 마리/NNB 가/JKS 날아오/VV 았/EP 습니다/EF ./SF
2066,"/SS 하/IC ,/SP 절__01/NNG 에서/JKB 는/JX 사람/NNG 수소문/NNG 이/JKS 안/MAG 되__01/VV 는데요/EC …/SE ./SF "/SS
2067,"/SS 뱃속/NNG 에서/JKB 잘/MAG 크/VV 거라/EF ./SF
2068,변화/NNG 하/XSV ᆫ다는/ETM 점__10/NNG 에서/JKB [/SS 동적__01/NNG (/SS dynamic/SL )/SS 성격__02/NNG ]/SS 이/VCP 라/EC 부르/VV ᆫ다/EF ./SF
2069,시장__04/NNG 에서/JKB "/SS 에이/IC 신경질/NNG 나/VV 아/EF !/SF
2070,▴/SW 홈__04/NNG 플레이트/NNG 뒤쪽__01/NNG 에서/JKB 지켜보/VV ᆫ/ETM 주심__02/NNG 이/JKS 정확히__01/MAG 판정/NNG 하/XSV 았/EP 다/EF ./SF
2071,남자__02/NNG 가/JKS 여자__02/NNG 의/JKG 방__07/NNG 에서/JKB 함께/MAG 지내/VV 는/ETM 것/NNB 이/JKS 수치__03/NNG 가/JKC 아니/VCN 다/EF ./SF
2072,그런/MM 아버지/NNG 의/JKG 모습__01/NNG 이/JKS 지금__03/NNG 도/JX 나/NP 의/JKG 머릿속/NNG 에서/JKB 맴돌/VV 고/EC 있/VX 다/EF ./SF
2073,정보__06/NNG 화/XSN 시대__02/NNG 에서/JKB 교육/NNG 받__01/VV 은/ETM 사람/NNG 이란/JX 무엇/NP 을/JKO 뜻/NNG 하/XSV 는가/EF ?/SF
2074,그녀/NP 는/JX 목__01/NNG 너머/NNG 에서/JKB 울음/NNG 이/JKS 넘어오/VV 았/EP 다/EF ./SF
2075,김명근/NNP 이/JKS 먼저/MAG 자리__01/NNG 에서/JKB 일어나/VV 았/EP 다/EF ./SF
2076,한/MM 시간__04/NNG 만/JX 이/MM 근처/NNG 에서/JKB 얼쩡거리/VV 어라/EF ./SF
2077,그러나/MAJ 막상/MAG 뒷골목/NNG 에서/JKB 는/JX 픽픽/MAG 웃/VV 기/ETN 만/JX 하/VX 았었/EP 다/EF ./SF
2078,하/VV ᆫ다/EC 든가/JX 동무__01/NNG ,/SP 혹시__01/MAG 국방군/NNG 에서/JKB 낙오/NNG 하/XSV ᆫ/ETM 것/NNB 이/JKS 아니/VCN 요/EF ?/SF
2079,결단코/MAG 그/MM 앞/NNG 에서/JKB 는/JX 눈물__01/NNG 을/JKO 보이__02/VV 지/EC 않/VX 으리라/EC 다짐/NNG 하/XSV 았/EP 다/EF ./SF
2080,그런/MM 상황__02/NNG 에서/JKB 언론/NNG 의/JKG 사회__07/NNG 적/XSN 영향력/NNG 은/JX 그리__02/MAG 크/VA 지/EC 못하/VX 았/EP 다/EF ./SF
2081,그러나/MAJ 나/NP 는/JX 거기/NP 에서/JKB 일단/MAG 생각__01/NNG 을/JKO 멈추/VV 었/EP 다/EF ./SF
2082,그리고/MAJ 지금__03/MAG 막__05/NNG 에서/JKB 기다리/VV ᆯ/ETM 옥점이/NNP 를/JKO 생각__01/NNG 하/XSV 았/EP 다/EF ./SF
2083,여기/NP 에서/JKB 도/JX 충효/NNG 가/JKS 기본/NNG 으로/JKB 되__01/VV 어/EC 있/VX 다/EF ./SF
2084,학원__02/NNG 에서/JKB 산수__05/NNG 공부__01/NNG 를/JKO 하/VV ᆯ/ETM 때__01/NNG 이/VCP 었/EP 다/EF ./SF
2085,그런/MM 뜻/NNG 에서/JKB ᆫ/JX 승부__03/NNG 없이/MAG 끝나/VV ᆫ/ETM 6/SN ./SF 25/SN
2086,각기둥/NNG 평면/NNG 도형__03/NNG 을/JKO 공간__05/NNG 에서/JKB 평행/NNG 이동__03/NNG 하/XSV 아/EC 만들/VV ᆫ/ETM 입체__02/NNG 도형__03/NNG 의/JKG 하나/NR ./SF
2087,앞/NNG 에서/JKB 이런/MM 경우__03/NNG 는/JX 첫/MM 칸__01/NNG 을/JKO 비우__01/VV 라고/EC 경고__04/NNG (/SS !/SF )/SS 하/XSV 았/EP 으니/EC
2088,이__05/MM 아파트/NNG 에서/JKB 얼마/NNG 전__08/NNG 에/JKB 소동__02/NNG 이/JKS 있/VV 었/EP 다/EF ./SF
2089,교문__01/NNG 에서/JKB 왜/MAG 붙잡히/VV ᆫ단/ETM 말__01/NNG 이/VCP ᆫ가/EF ./SF
2090,세상__01/NNG 에서/JKB 책__01/NNG 이/VCP 란/ETM 책__01/NNG 은/JX 모조리/MAG 불사르/VV 아/EC 버리/VX 자/EC "/SS
2091,"/SS 그거/NP ,/SP 국무성/NNG 에서/JKB 통지__03/NNG 오/VV 았/EP 습니다/EF ./SF "/SS
2092,"/SS 턱밑/NNG 에서/JKB 너무/MAG 그러/VV 지/EC 말/VX 아/EF ./SF
2093,그/MM 중__04/NNB 에서/JKB 도/JX 제/XPN 일/NR 크/VA ᆫ/ETM 고생/NNG 이/JKS 잠__01/NNG 부족__01/NNG 이/VCP 다/EF ./SF
2094,속셈/NNG 학원__02/NNG 에서/JKB 의/JKG 영어/NNP 지도__09/NNG 는/JX 두/MM 가지/NNB 형태/NNG 로/JKB 나누/VV 어/EC 지/VX ᆫ다/EF ./SF
2095,"/SS 너무/MAG 지나치/VA 지/EC 않/VX 아/EC ,/SP 교장__03/NNG 선생__01/NNG 님/XSN 앞/NNG 에서/JKB …/SE …/SE "/SS
2096,스타/NNG 는/JX 위기__01/NNG 에서/JKB 강/XR 하/XSA 다고/EC 하/VV 았/EP 던가/EF ./SF
2097,-/SS 교사__09/NNG 임용__01/NNG 과정__03/NNG 에서/JKB 의/JKG 금품/NNG 수수__08/NNG 도/JX 불신__02/NNG 을/JKO 낳__01/VV 고/EC 있/VX 는데/EF ./SF
2098,영미/NNP 에서/JKB 는/JX [/SS Danger/SL ]/SS 이/VCP 란/ETM 표시__02/NNG 를/JKO 쓰__03/VV ᆫ다/EF ./SF
2099,그/MM 머리말/NNG 에서/JKB 미국/NNP 의/JKG 한/MM 선사__14/NNG 베이커/NNP 는/JX 다음__01/NNG 과/JKB 같이/MAG 밝히/VV 었/EP 다/EF ./SF
2100,순간__03/NNG 심장__02/NNG 구멍/NNG 에서/JKB 새빨갛/VA ᆫ/ETM 피__02/NNG 가/JKS 분출__03/NNG 하/XSV 기/ETN 시작__01/NNG 하/XSV 았/EP 다/EF ./SF
2101,어둠/NNG 속__01/NNG 에서/JKB 도/JX 희미/XR 하/XSA 게/EC 나마/JX 남자__02/NNG 의/JKG 윤곽/NNG 이/JKS 또렷이/MAG 보이__01/VV 었/EP 다/EF ./SF
2102,선창__06/NNG 에서/JKB 낚시/NNG 꾼/XSN 안내선/NNG 한/MM 척__08/NNB 이/JKS 뜨__01/VV 고/EC 있/VX 었/EP 다/EF ./SF
2103,병실__02/NNG 문__05/NNG 앞/NNG 에서/JKB 아저씨/NNG 는/JX 잠깐/MAG 망설이/VV 었/EP 습니다/EF ./SF
2104,온라인/NNG 소설__03/NNG 발표__01/NNG 는/JX 미국/NNP 에서/JKB 도/JX 흔하/VA ᆫ/ETM 일__01/NNG 은/JX 아니/VCN 다/EF ./SF
2105,침샘/NNG 과/JC 위__01/NNG 에서/JKB 배출__02/NNG 되/XSV 는/ETM 물__01/NNG 도/JX 엄청나/VA 다/EF ./SF
2106,그러자/MAJ 이웃집/NNG 에서/JKB 다시/MAG 멸치/NNG 가/JKS 더/MAG 들어가__01/VV 았/EP 다/EF ./SF
2107,수면__01/NNG 에서/JKB 서서히/MAG 융기__02/NNG 하/XSV ᆫ/ETM 파도/NNG 가/JKS 육중/XR 하/XSA 게/EC 밀려오/VV 지요/EF ./SF
2108,한참/NNG 이나/JX 아궁/NNG 에서/JKB 낙엽/NNG 타__01/VV 는/ETM 소리__01/NNG 뿐/JX 이/VCP 었/EP 다/EF ./SF
2109,수도꼭지/NNG 의/JKG 물__01/NNG 은/JX 어디/NP 에서/JKB 오/VV ᆯ까/EF ./SF
2110,정석/NNP 이/JKS 얼른/MAG 옥상__03/NNG 에서/JKB 뛰쳐나가/VV 았/EP 다/EF ./SF
2111,그러니까/MAJ 그/MM 자리__01/NNG 에서/JKB 나/NP 는/JX 곧/MAG 취직/NNG 이/JKC 되__01/VV ᆫ/ETM 것/NNB 이/VCP 었/EP 다/EF ./SF
2112,그러면/MAJ 배우자__02/NNG 선택/NNG 에서/JKB 는/JX 어떤/MM 점__10/NNG 들/XSN 을/JKO 고려__01/NNG 하/XSV 아야/EC 하/VV ᆯ까/EF ./SF
2113,우리/NP 는/JX 기차역/NNG 에서/JKB 만나/VV 았/EP 다/EF ./SF
2114,대학교/NNG 에서/JKB 맞__02/VV 는/ETM 여름__01/NNG 방학/NNG ./SF
2115,차__06/NNG 안__01/NNG 에서/JKB 숙녀/NNG 가/JKS 제발/MAG 되__01/VV 시/EP 오/EF !/SF
2116,과식__01/NNG 이나/JC 과음__02/NNG 하/XSV ᆫ/ETM 상태__01/NNG 에서/JKB 의/JKG 목욕/NNG 은/JX 되도록/MAG 피하/VV 아야/EC 하/VX ᆫ다/EF ./SF
2117,지금__03/NNG 은/JX 그/MM 집__01/NNG 에서/JKB 모두/MAG 나오/VV 아야/EC 하/VX ᆫ다/EF ./SF
2118,그/NP 가/JKS 돌개/NNP 에서/JKB 유일__06/NNG 하/XSA 게/EC 두려워하/VV 는/ETM 인물/NNG 이/JKS 바로/MAG 동욱/NNP 이/VCP 었/EP 다/EF ./SF
2119,이러/XR 하/XSA ᆫ/ETM 상황__02/NNG 에서/JKB 대들/VV 어/EC 보/VX 라/EF !/SF
2120,이__05/MM 번/NNB 에/JKB 는/JX 아주/MAG 나/NP 의/JKG 귀__01/NNG 가까이/NNG 에서/JKB 소리__01/NNG 가/JKS 들리__03/VV 었/EP 습니다/EF ./SF
2121,이번__01/NNG 잠실/NNP 시리즈/NNG 에서/JKB LG/SL 가/JKS 기대__01/VV 는/ETM 유일__06/NNG 하/XSA ᆫ/ETM 버팀목/NNG 이/VCP 다/EF ./SF
2122,손/NNP 오공/NNP 은/JX 그/MM 이야기/NNG 밖/NNG 에서/JKB 는/JX 존재/NNG 가/JKS 없/VA 다/EF ./SF
2123,미/NNP 군정__02/NNG 도/JX 이/NP 에서/JKB 예외/NNG 적/XSN 이/VCP ᆯ/ETM 수__02/NNB 없/VA 었/EP 다/EF ./SF
2124,나/NP ᆫ/JX 세상__01/NNG 의/JKG 중심__01/NNG 에서/JKB 놀/VV 겠/EP 다고/EF ./SF
2125,나/NP 는/JX 이__05/MM 사실__04/NNG 을/JKO 우리/NP 반__10/NNG 에서/JKB 가장__01/MAG 먼저/MAG 알/VV 았/EP 다/EF ./SF
2126,[/SS 원귀도/NNG ]/SS 에서/JKB '/SS 진양__01/NNG ,/SP 계면__03/NNG '/SS 을/JKO 빼앗/VV 다니/EF !/SF
