Number,Sentence
967,한국/NNP 영화__01/NNG 가/JKS 국제__02/NNG 무대__06/NNG 에서/JKB 또/MAG 한번/NNG 개가__03/NNG 를/JKO 올리__01/VV 었/EP 다/EF ./SF
968,나/NP 는/JX 길__01/NNG 에서/JKB N/SL 과/JKB 만나/VV 았/EP 던/ETM 것/NNB 이/VCP 다/EF ./SF
969,학교/NNG 에서/JKB 집__01/NNG 으로/JKB 돌아가/VV 는/ETM 아이__01/NNG 들/XSN 이/VCP 다/EF ./SF
970,안토니오/NNP 스트라디바리/NNP ,/SP 17/SN 세기말/NNG 북이탈리아/NNP 에서/JKB 살__01/VV 았/EP 던/ETM 바이올린/NNG 제작자/NNG 이/VCP 지/EF ./SF
971,골목__01/NNG 저/MM 쪽__05/NNB 에서/JKB 수은등/NNG 불빛/NNG 이/JKS 비쳐들어오/VV 았/EP 다/EF ./SF
972,학교/NNG 에서/JKB 독일/NNP 말__01/NNG 가르치__01/VV 었/EP 어/EF ./SF
973,그것/NP 의/JKG 영감__03/NNG 은/JX 왜곡/NNG 되/XSV ᆫ/ETM 현실__02/NNG 에서/JKB 오/VV ᆫ다/EF ./SF
974,현대/NNP 에서/JKB 는/JX 이명수/NNP 가/JKS 그/MM 역할/NNG 을/JKO 하/VV 고/EC 있/VX 다/EF ./SF
975,영어/NNP 로/JKB 되__01/VV ᆫ/ETM 글/NNG 에서/JKB 도/JX 마찬가지/NNG 이/VCP 다/EF ./SF
976,공처가/NNG 들/XSN 은/JX 매일/NNG 같이/JKB 아내__01/NNG 앞/NNG 에서/JKB 떨__01/VV 어야/EC 하/VX ᆫ다/EF ./SF
977,육천/NR 에서/JKB 육백/NR 을/JKO 보태/VV 면/EC 육천/NR 육백/NR 이/VCP 지요/EF ?/SF "/SS
978,보스니아/NNP 용병__05/NNG 아미르/NNP 는/JX 코리안/NNG 리그__01/NNG 에서/JKB 터뜨리/VV ᆫ/ETM 2/SN 골__14/NNG 모두__01/NNG 가/JKS 결승__01/NNG 골__14/NNG ./SF
979,다시/MAG ,/SP 입/NNG 안__01/NNG 에서/JKB 바람__01/NNG 은/JX 마음__01/NNG 대로/JX 놀/VV ᆫ다/EF ./SF
980,내/NP 가/JKS 로스엔젤레스/NNP 에서/JKB 일__01/NNG 하/XSV ᆯ/ETM 때__01/NNG 그/NP 는/JX 샌프란시스코/NNP 에/JKB 있/VV 었/EP 죠/EF ./SF
981,더/MAG 높/VA 은/ETM 곳__01/NNG 에서/JKB 닥달/NNG 이/VCP 야/EF ./SF
982,머리__01/NNG 속__01/NNG 에서/JKB ᆫ/JX 연신/MAG 비판__01/NNG 과/JC 부정__09/NNG 하/XSV 는/ETM 사고__14/NNG 가/JKS 쏟아지/VV 었/EP 다/EF ./SF
983,요즘/NNG 기존/NNG 의/JKG 민주노조/NNP 지도부/NNG 들/XSN 이/JKS 선거__04/NNG 에서/JKB 패배/NNG 하/XSV 는/ETM 일__01/NNG 이/JKS 많/VA 지/EF ./SF
984,흰색/NNG 지프/NNG 앞쪽/NNG 에서/JKB 는/JX 희미/XR 하/XSA ᆫ/ETM 연기__09/NNG 가/JKS 솟아오르/VV 고/EC 있/VX 었/EP 지/EF ./SF
985,하늘/NNG 에서/JKB 는/JX 헤라/NNP 여신__03/NNG 의/JKG 저주__03/NNG 가/JKS 미치__02/VV 지/EC 않/VX 기/ETN 때문/NNB 이/VCP 었/EP 다/EF ./SF
986,옛날/NNG 중국/NNP 에서/JKB 있/VV 었/EP 던/ETM 일__01/NNG 이/VCP 다/EF ./SF
987,말__01/NNG 하/XSV 자면/EC 그/MM 연쇄__01/NNG 방화__06/NNG 사건__01/NNG 에서/JKB 도/JX 그런/MM 냄새/NNG 가/JKS 풍기/VV 었/EP 다/EF ./SF
988,그러나/MAJ 청나라/NNP 에서/JKB 는/JX 이/MM 곳__01/NNG 을/JKO 쌍성자/NNP (/SS 雙城子/SH )/SS 이/VCP 라고/EC 부르/VV 었/EP 다/EF ./SF
989,토종닭/NNG 이/JKS 시장__04/NNG 에서/JKB 자취__01/NNG 를/JKO 감추/VV 어/EC 가/VX 던/ETM 즈음/NNB 이/VCP 었/EP 다/EF ./SF
990,그러나/MAJ 현실__02/NNG 의/JKG 관점__02/NNG 에서/JKB 그것/NP 을/JKO 완전히/MAG 받아들이/VV ᆫ다/EF ./SF
991,해변/NNG 에서/JKB 는/JX 제법/MAG 후텁지근/XR 하/XSA ᆫ/ETM 바닷바람/NNG 이/JKS 불어오/VV 았/EP 다/EF ./SF
992,80/SN 년대/NNB 초__03/NNB 시골/NNG 에서/JKB 당시__02/NNG 총리__01/NNG 의/JKG 방문__03/NNG 을/JKO 받__01/VV 았/EP 다/EF ./SF
993,그리고/MAJ 워싱턴/NNP 에서/JKB 다시/MAG 여섯/NR 시__10/NNG 뉴욕행/NNG 비행기/NNG 를/JKO 갈아타/VV 아야/EC 하/VX 았/EP 다/EF ./SF
994,전투/NNG 에서/JKB 사람/NNG 이/JKS 죽__01/VV 는/ETM 것/NNB 또한/MAG 일상__04/NNG 이/VCP 다/EF ./SF
995,그런데/MAJ 그/MM 핏자국/NNG 이/JKS 어느/MM 연못가/NNG 에서/JKB 뚝__02/MAG 그치/VV 어/EC 있/VX 는/ETM 거/NNB 이/VCP 야/EF ./SF
996,학생/NNG 과/JC 전경__09/NNG 이/JKS 대립__03/NNG 되/XSV 는/ETM 도로__07/NNG 한/XPN 복판__01/NNG 에서/JKB 카섹스/NNG 를/JKO 하/VV 지/EF ./SF
997,별님이/NNP 는/JX 엄마/NNG 옆/NNG 에서/JKB 조용히/MAG 이야기/NNG 를/JKO 듣__01/VV 고/EC 있/VX 고요/EF ./SF
998,악덕/NNG 상/XSN 이/VCP ᆫ/ETM 앞/NNG 에서/JKB 비분강개/NNG 만/JX 하/VV ᆯ/ETM 것/NNB 이/JKC 아니/VCN 다/EF ./SF
999,"/SS 그럼/IC ,/SP 너/NP 우리/NP 집__01/NNG 에서/JKB 같이/MAG 살__01/VV 자/EF ./SF "/SS
1000,그/NP 는/JX 나/NP 의/JKG 마음__01/NNG 이/VCP 라는/ETM 밭/NNG 에서/JKB 반짝이/VV 는/ETM 별/NNG 이/VCP 야/EF ./SF
1001,그것/NP 은/JX 외교__01/NNG 교섭/NNG 에서/JKB 흔히/MAG 있/VV 는/ETM 일__01/NNG 이/VCP 기/ETN 도/JX 하/VX 다/EF ./SF
1002,그러나/MAJ 63/SN 년__02/NNB 이후__02/NNG 연어__04/NNG 는/JX 라인강/NNP 에서/JKB 자취__01/NNG 를/JKO 감추/VV 었/EP 다/EF ./SF
1003,컴퓨터/NNG 는/JX 미술/NNG 에서/JKB 도/JX 테레빈/NNG 기름__01/NNG 의/JKG 냄새/NNG 를/JKO 조금__01/NNG 씩/XSN 밀어내/VV 고/EC 있/VX 다/EF ./SF
1004,순자/NNP 는/JX 이런/MM 상황__02/NNG 에서/JKB 예__15/NNG 에/JKB 의하/VV ᆫ/ETM 통치__03/NNG 를/JKO 주장__03/NNG 하/XSV 았/EP 습니다/EF ./SF
1005,그러나/MAJ 헤라/NNP 는/JX 카나토스샘/NNP 에서/JKB 이것/NP 을/JKO 회복/NNG 하/XSV ᆯ/ETM 수__02/NNB 있/VV 다/EF ./SF
1006,게임/NNG 이/VCP ᆫ/ETM 야구__02/NNG 에서/JKB 는/JX 더욱/MAG 그렇/VA 다/EF ./SF
1007,그/MM 미녀/NNG 들/XSN 의/JKG 숲__01/NNG 속__01/NNG 에서/JKB 필자__02/NNG 는/JX 전야제/NNG MC/SL 를/JKO 하/VV 았/EP 다/EF ./SF
1008,이런/MM 상황__02/NNG 에서/JKB 약정__02/NNG 은/JX 약정__02/NNG 대로/JX 올리__01/VV 어야/EC 하/VX 았/EP 다/EF ./SF
1009,이/MM 중__04/NNB 에서/JKB 무왕/NNP 의/JKG 무덤/NNG 이/VCP ᆯ/ETM 가능/XR 성/XSN 이/JKS 높/VA 다/EF ./SF
1010,가정__06/NNG 2/SN 명제/NNG 에서/JKB 전제/NNG 가/JKC 되__01/VV 는/ETM 부분__01/NNG ./SF
1011,출장지/NNG 에서/JKB 의/JKG 생활/NNG 은/JX 자칫/MAG 하/XSV 면/EC 불/XPN 규칙__02/NNG 하/XSA 아/EC 지/VX 기/ETN 쉽/VA 다/EF ./SF
1012,어디/NP 재단__02/NNG 에서/JKB 운영__03/NNG 하/XSV 는데/EC 값/NNG 도/JX 싸__05/VA 고/EC 시설__03/NNG 도/JX 훌륭/XR 하/XSA 다는데요/EF ./SF
1013,저/NP 는/JX 시댁/NNG 에서/JKB 여의주/NNG 를/JKO 처음/NNG 보__01/VV 았/EP 습니다/EF ./SF
1014,법정__01/NNG 에서/JKB ᆫ/JX 또/MAG 한/MM 번/NNB 희비/NNG 가/JKS 엇갈리/VV 었/EP 다/EF ./SF
1015,나/NP 는/JX 그/MM 집__01/NNG 에서/JKB 사흘/NNG 을/JKO 머물/VV 었/EP 다/EF ./SF
1016,총무/NNG 님/XSN 이/JKS 나/NP 의/JKG 앞/NNG 에서/JKB 걸음/NNG 을/JKO 멈추/VV 며/EC 말__01/NNG 하/XSV 았/EP 다/EF ./SF
1017,한국/NNP 에서/JKB 도/JX 유선__01/NNG 방송__01/NNG 의/JKG 도입/NNG 으로/JKB 다매체/NNG 다채널/NNG 시대__02/NNG 가/JKS 열리__02/VV 었/EP 다/EF ./SF
1018,그러나/MAJ 38/SN 선__14/NNG 에서/JKB 그만/MAG 행로/NNG 가/JKS 막히/VV 고/EC 말/VX 았/EP 다/EF ./SF
1019,그러면/MAJ 사령제/NNG 에서/JKB 바리/NNP 공주__01/NNG 신화__04/NNG 를/JKO 읊/VV 는/ETM 까닭/NNG 은/JX 무엇/NP 이/VCP ᆯ까/EF ./SF
1020,외환__02/NNG 위기__01/NNG 이후__02/NNG 혁신/NNG 은/JX 우리나라/NNG 기업__01/NNG 경영__02/NNG 에서/JKB 중요__02/NNG 하/XSA ᆫ/ETM 화두__04/NNG 가/JKC 되__01/VV 었/EP 다/EC
1021,이놈/NP 의/JKG 데/NNB 에서/JKB ᆫ/JX 세상__01/NNG 사람/NNG 이/JKS 다/MAG 외롭/VA ᆫ/ETM 것/NNB 이/VCP ᆫ디/EF ./SF
1022,K/SL 는/JX 호주머니/NNG 에서/JKB 담뱃갑/NNG 을/JKO 꺼내/VV 었/EP 다/EF ./SF
1023,겨울철/NNG 마을__01/NNG 공터/NNG 에서/JKB 많이/MAG 놀/VV 는/ETM 놀이__01/NNG 이/VCP 다/EF ./SF
1024,그것/NP 은/JX 특수학교/NNG 에서/JKB 하/VV 는/ETM 것/NNB 이/VCP ᄇ니다/EF ./SF
1025,그러/XR 하/XSA ᆫ/ETM 환상__02/NNG 속__01/NNG 에서/JKB 살__01/VV 고/EC 싶/VX 었/EP 던/ETM 것/NNB 이/VCP 다/EF ./SF
1026,미국/NNP 조지타운대/NNP 윌리암스/NNP 칼리지/NNG 에서/JKB 두/MM 사람/NNG 은/JX 같이/MAG 학교/NNG 를/JKO 다니/VV 었/EP 다/EF ./SF
1027,관세__03/NNG 의/JKG 부과__05/NNG ,/SP 징수__02/NNG 등/NNB 의/JKG 사무__05/NNG 는/JX 세관__05/NNG 에서/JKB 맡__01/VV 아/EC 보/VX ᆫ다/EF ./SF
1028,이런/MM 속셈/NNG 에서/JKB 시비__05/NNG 를/JKO 걸/VV 었/EP 다/EF ./SF
1029,이/MM 중__04/NNB 에서/JKB 선전__03/NNG 활동__02/NNG 을/JKO 예__08/NNG 로/JKB 들__04/VV 어/EC 보/VX 겠/EP 다/EF ./SF
1030,천/NR 년__02/NNB 만년__02/NNG 감옥__02/NNG 보다/JKB 더/MAG 하/XSA ᆫ/ETM 이/MM 방__07/NNG 에서/JKB 살__01/VV 아/EC 보/VX 아라/EF ./SF
1031,1981/SN 년__02/NNB 10/SN 월/NNB 9/SN 일/NNB ,/SP 세종문화회관/NNP 에서/JKB 는/JX 한글날/NNG 기념식/NNG 이/JKS 있/VV 었/EP 다/EF ./SF
1032,문__05/NNG 저/MM 편__04/NNG 에서/JKB 는/JX 그러나/MAJ 아무런/MM 기척__01/NNG 이/JKS 없/VA 었/EP 다/EF ./SF
1033,쉽/VA 게/EC 말__01/NNG 하/XSV 아서/EC 수학__05/NNG 에서/JKB 말__01/NNG 하/XSV 는/ETM 일차원/NNG 은/JX 선__14/NNG 이/VCP ᄇ니다/EF ./SF
1034,혹은/MAG 지나/VV ᆫ/ETM 1/SN 년__02/NNB 동안__01/NNG 의/JKG 반성__01/NNG 과/JC 새/MM 학년/NNG 에서/JKB 의/JKG 각오__01/NNG
1035,"/SS 댁/NNG 에서/JKB 걱정/NNG 을/JKO 하/VV 지/EC 않/VX 겠/EP 어요/EF ./SF "/SS
1036,사타구니/NNG 에서/JKB 버얼써/MAG 딸랑__01/MAG 소리__01/NNG 나/VV 았/EP 지러/EF ./SF
1037,삼성전자/NNP 측/NNB 에서/JKB 도/JX 이/NP 를/JKO 해명__02/NNG 하/XSV 기에/EC 여념/NNG 이/JKS 없/VA 다/EF ./SF
1038,어머니/NNG 는/JX 여전히/MAG 입/NNG 에서/JKB 손__01/NNG 을/JKO 떼__01/VV 지/EC 않/VX 은/ETM 채__09/NNB 이/VCP 었/EP 다/EF ./SF
1039,터키/NNP 에서/JKB 커피/NNG 를/JKO 마시/VV ᆯ/ETM 때__01/NNG 한/MM 가지/NNB 주의__07/NNG 하/XSV ᆯ/ETM 점__10/NNG !/SF
1040,딘/NNP 후보__04/NNG 는/JX 선거__04/NNG 자금__08/NNG 모금/NNB 실적__05/NNG 에서/JKB 는/JX 여전히/MAG 선두__01/NNG 를/JKO 달리__04/VV 고/EC 있/VX 다/EF ./SF
1041,갑자기/MAG 그/NP 들/XSN 이/JKS 서/VV 어/EC 있/VX 는/ETM 바로/MAG 옆/NNG 에서/JKB 빠방/MAG !/SF
1042,숨골__01/NNG 에서/JKB 하/VV 는/ETM 가장__01/MAG 중요__02/NNG 하/XSA ᆫ/ETM 역할/NNG 은/JX 무엇/NP 이/VCP ᆫ가/EF ?/SF
1043,옆/NNG 에서/JKB 다른/MM 사람/NNG 들/XSN 이/JKS 무심히/MAG 들여다보/VV 았/EP 다가/EC 는/JX 엥이/IC !/SF
1044,회사__04/NNG 건물__03/NNG 앞/NNG 노점__03/NNG 에서/JKB 팔/VV 는/ETM 샌드위치/NNG 가/JKS 최수진/NNP 의/JKG 아침/NNG 이/VCP 었/EP 다/EF ./SF
1045,간장__03/NNG 은/JX 우리/NP 의/JKG 몸속/NNG 에서/JKB 오른쪽/NNG 옆구리/NNG 갈비뼈/NNG 속__01/NNG 에/JKB 들__01/VV 어/EC 있/VX 다/EF ./SF
1046,이/MM 점__10/NNG 에서/JKB 민홍/NNP 의/JKG 아버지/NNG 에게/JKB ᆫ/JX 여한__01/NNG 이/JKS 없/VA 다/EF ./SF
1047,6/SN 차전/NNG 에서/JKB 끝내/VV 려고/EC 무리__08/NNG 하/XSV 지/EC 는/JX 않/VX 을/ETM 생각__01/NNG 이/VCP 다/EF ./SF
1048,노장윤/NNP 씨/NNB 는/JX 우리/NP 집__01/NNG 에서/JKB 가장__01/MAG 연배/NNG 가/JKS 높/VA 은/ETM 형__01/NNG 님/XSN 이/VCP 다/EF ./SF
1049,방학/NNG 은/JX 서울/NNP 에서/JKB 다/MAG 보내/VV 겠/EP 네/EF ?/SF "/SS
1050,마이크/NNG 앞/NNG 에서/JKB 는/JX 누구/NP 나/JX 떨리__01/VV 기/ETN 마련/NNB 이/VCP 다/EF ./SF
1051,중학교/NNG 에서/JKB 물상__01/NNG 을/JKO 가르치__01/VV 고/EC 계시/VX ᆫ대요/EF ./SF
1052,이국땅/NNG 에서/JKB 고구려/NNP 의/JKG 핏줄/NNG 을/JKO 보__01/VV ᆫ/ETM 것/NNB 이/VCP 다/EF ./SF
1053,아기__01/NNG 아버지/NNG 는/JX 병원__02/NNG 앞/NNG 에서/JKB 발__01/NNG 을/JKO 멈추/VV 었/EP 습니다/EF ./SF
1054,남편__01/NNG 은/JX 끝__01/NNG 까지/JX 부엌/NNG 에서/JKB 나오/VV 지/EC 않/VX 았/EP 다/EF ./SF
1055,그러나/MAJ 갑동이/NNP 는/JX 방__07/NNG 에서/JKB 돌쇠/NNP 를/JKO 환하/VA 게/EC 보/VX 고/EC 있/VX 었/EP 다/EF ./SF
1056,다시/MAG ,/SP 땅바닥/NNG 에서/JKB 기__01/VV 게/EC 하/VX ᆫ다/EF ./SF
1057,우리/NP 집__01/NNG 에서/JKB 나/NP 와/JKB 함께/MAG 살__01/VV 자/EF ./SF "/SS
1058,다만/MAG 언론/NNG 의/JKG 사각__07/NNG 에서/JKB 울__01/VV 고/EC 있/VX 었/EP 을/ETM 뿐/NNB 이/VCP 다/EF ./SF
1059,종애/NNP 가/JKS 수화기/NNG 저편/NP 에서/JKB 나타나/VV ᆫ다/EF ./SF
1060,이것/NP 은/JX 우리/NP 나라/NNG 에서/JKB 만/JX 이루어지/VV 고/EC 있/VX 는/ETM 일__01/NNG 이/JKC 아니/VCN 다/EF ./SF
1061,은행__02/NNG 의/JKG 주__26/NNG 5/SN 일/NNB 근무/NNG 제/XSN 시행__01/NNG 도/JX 이런/MM 맥락/NNG 에서/JKB 보__01/VV 고/EC 있/VX 다/EF ./SF
1062,한쪽/NNG 에서/JKB 는/JX 싸움/NNG 이/JKS 벌어지__02/VV 었/EP 다/EF ./SF
1063,이런/MM 일__01/NNG 들/XSN 로/JKB 단체__02/NNG 에서/JKB 눈치/NNG 가/JKS 보이__01/VV ᆫ다/EF ./SF
1064,부가__02/NNG 가치__06/NNG 개개/NNG 의/JKG 기업__01/NNG 이나/JC 산업/NNG 이/JKS 생산/NNG 과정__03/NNG 에서/JKB 새로이/MAG 더하/VV ᆫ/ETM 값어치/NNG ./SF
1065,그/MM 곳__01/NNG 에서/JKB 작업__01/NNG 하/XSV 는/ETM 인부__01/NNG 들/XSN 의/JKG 모습__01/NNG 이/JKS 온통/MAG 새까맣/VA 았/EP 다/EF ./SF
1066,환기__02/NNG 의/JKG 중요__02/NNG 성/XSN 은/JX 개별/NNG 가옥__01/NNG 의/JKG 사례__05/NNG 에서/JKB 단적__02/NNG 으로/JKB 드러나/VV ᆫ다/EF ./SF
1067,교통사고/NNG 를/JKO 내__02/VV ᆫ/ETM 두/MM 운전자/NNG 가/JKS 파출소/NNG 에서/JKB 한창/MAG 입씨름/NNG 중__04/NNB 이/VCP 었/EP 습니다/EF ./SF
1068,바로/MAG 그/MM 구분__06/NNG 이/JKS 해체__03/NNG 되/XSV ᆫ/ETM 상황__02/NNG 에서/JKB 나타나/VV 는/ETM 것/NNB 이/JKS 테러/NNG 이/VCP 니까/EF ./SF
1069,미국/NNP 에서/JKB 1830/SN 년대/NNB 는/JX 흔히/MAG '/SS 저널리즘/NNG 의/JKG 혁명기/NNG '/SS 로/JKB 불리__04/VV 고/EC 있/VX 다/EF ./SF
1070,마르크스/NNP 의/JKG 역사__04/NNG 에서/JKB 사상__15/NNG 투쟁/NNG 은/JX 중대/NNG 하/XSA ᆫ/ETM 의의__04/NNG 를/JKO 지니/VV ᆫ다/EF ./SF
1071,신/XPN 도시__03/NNG 사람/NNG 들/XSN 은/JX 신/XPN 도시__03/NNG 에서/JKB 안/MAG 놀/VV 지만/EF ./SF
1072,모든/MM 것/NNB 이/JKS 얼어붙/VV 은/ETM 이__05/MM 겨울/NNG 의/JKG 한/XPN 복판__01/NNG 에서/JKB 말__01/NNG 이/VCP 야/EF ./SF "/SS
1073,모스크바/NNP 에서/JKB 기차__01/NNG 로/JKB 레닌그라드/NNP 에/JKB 내리/VV 었/EP 다/EF ./SF
1074,표__02/NNG 나/JC 그림__01/NNG 은/JX 논문/NNG 의/JKG 내용__02/NNG 에서/JKB 상당히/MAG 중요__02/NNG 하/XSA ᆫ/ETM 구실__01/NNG 을/JKO 하/VV ᆫ다/EF ./SF
1075,술__01/NNG 은/JX 빈/NNP 의/JKG 숲__01/NNG 에서/JKB 명물/NNG 로/JKB 통하/VV 는/ETM 호이리게/NNP 이/VCP 었/EP 다/EF ./SF
1076,대로변/NNG 의/JKG 상점/NNG 에서/JKB 는/JX 전쟁/NNG 기념품/NNG 을/JKO 팔/VV 기/ETN 도/JX 하/VX ᆫ다/EF ./SF
1077,병원__02/NNG 에서/JKB 는/JX 급성/NNG 맹장염/NNG 이/VCP 라/EC 하/VV 았/EP 습니다/EF ./SF
1078,기계__07/NNG 의/JKG 관점__02/NNG 에서/JKB 보__01/VV ᆫ다면/EC 기계어/NNG 프로그램/NNG 이/JKS 가장__01/MAG 명확/XR 하/XSA ᆫ/ETM 것/NNB 이/VCP 다/EF ./SF
1079,가능/XR 하/XSA ᆫ/ETM 한__06/NNG 빨리/MAG 이/MM 사이클/NNG 에서/JKB 벗어나/VV 아야/EC 하/VX ᄇ니다/EF ./SF
1080,동현/NNP 은/JX 그/MM 대목__01/NNG 에서/JKB 나/NP 의/JKG 얼굴/NNG 을/JKO 흘끔/MAG 쳐다보/VV 았/EP 다/EF ./SF
1081,그/MM 어둠침침/XR 하/XSA ᆫ/ETM 계단__04/NNG 에서/JKB 도/JX 그녀/NP 는/JX 여전히/MAG 아름답/VA 었/EP 다/EF ./SF
1082,뒤__01/NNG 에서/JKB 영배/NNP 의/JKG 등__01/NNG 을/JKO 툭/MAG 치__02/VV 었/EP 다/EF ./SF
1083,─/SS ─/SS 나/NP 의/JKG 방__07/NNG 천장__02/NNG 에서/JKB 소리__01/NNG 가/JKS 나/VV 아서/EC 이/VCP 오/EF ./SF
1084,알/VV 다시피/EC 우리/NP 학교/NNG 는/JX 서울/NNP 시내__03/NNG 에서/JKB 진학/NNG 률/XSN 이/JKS 맨/MM 하위__02/NNG 이/VCP 었/EP 잖소/EF ./SF
1085,어떤/MM 지역__03/NNG 에서/JKB '/SS 여름__01/NNG 철학/NNG 세미나/NNG '/SS 가/JKS 열리__02/VV 었/EP 다/EF ./SF
1086,남__01/NNG 앞/NNG 에서/JKB 낫/VV ᆫ/ETM 척__01/NNB 하/XSV 는/ETM 것/NNB 이/JKS 흠/NNG 이/VCP 지만/EC 말__01/NNG 이/VCP 야/EF ./SF
1087,공연__02/NNG 기간__07/NNG 중__04/NNB 마로니에/NNG 공연__02/NNG 에서/JKB 장승/NNG 제작__02/NNG 및/MAG 전시회/NNG 도/JX 갖/VV 는다/EF ./SF
1088,물밑/NNG 에서/JKB 치열__04/NNG 하/XSA ᆫ/ETM 로비전/NNG 과/JC 홍보전/NNG 을/JKO 벌이/VV 고/EC 있/VX 다/EF ./SF
1089,여기/NP 서/JKB 공중__03/NNG 에서/JKB 외__02/VV 는/ETM 소리__01/NNG 란/JX 하느님/NNG 의/JKG 말씀/NNG 이/VCP ᆯ/ETM 것/NNB 이/VCP 다/EF ./SF
1090,사무실/NNG 에서/JKB 도/JX 눈__01/NNG 에/JKB 가장__01/MAG 띄__01/VV 던/ETM 꽃__01/NNG ./SF
1091,몬테카를로/NNP 에서/JKB 가장__11/NNG 무도회/NNG 가/JKS 열리__02/VV 었/EP 을/ETM 때__01/NNG 의/JKG 이야기/NNG 이/VCP 다/EF ./SF
1092,이__05/MM 강아지/NNG 는/JX ᄀ/NNG 선생__01/NNG 집__01/NNG 에서/JKB 먹이/VV 고/EC 있/VX 다/EF ./SF
1093,⑦/SW 농가__02/NNG 나/JC 어촌/NNG 에서/JKB 서풍/NNG (/SS 西風/SH )/SS 을/JKO 이르__02/VV 는/ETM 말__01/NNG ./SF
1094,예리/NNP 는/JX 혁진/NNP 의/JKG 대답/NNG 에서/JKB 그리움/NNG 의/JKG 냄새/NNG 를/JKO 맡__02/VV 았/EP 다/EF ./SF
1095,미국/NNP 에서/JKB 초기__04/NNG 의/JKG TV/SL 광고__02/NNG 는/JX 매우/MAG 조잡/XR 하/XSA 게/EC 만들/VV 어/EC 지/VX 었/EP 다/EF ./SF
1096,성__07/NNG 의/JKG 향연__02/NNG 은/JX 그곳/NP 에서/JKB 도/JX 농염/NNG 하/XSA 게/EC 무르익/VV 고/EC 있/VX 다/EF ./SF
1097,창고__01/NNG 뒤란/NNG 에서/JKB 그/NP 는/JX 동글납작/XR 하/XSA ᆫ/ETM 얼굴/NNG 과/JKB 마주/MAG 서/VV 었/EP 다/EF ./SF
1098,꿈__01/NNG 에서/JKB 나/NP 는/JX 수학__05/NNG 시험__03/NNG 을/JKO 치르/VV 어야/EC 하/VX 았/EP 다/EF ./SF
1099,아이젠/NNG 을/JKO 분실__02/NNG 하/XSV 고/EC 베이스__88/NNG 캠프/NNG 에서/JKB 주저앉/VV 은/ETM 알피니스트/NNG ./SF
1100,이/MM 시험__03/NNG 에서/JKB 점수__06/NNG 가/JKS 상위__01/NNG 13/SN %/SW 안__01/NNG 에/JKB 들__01/VV 어야/EC 하/VX ᆫ다/EF ./SF
1101,이__05/MM 충돌/NNG 은/JX 멕시코만/NNP 이나/JC 카리브해/NNP 에서/JKB 일어나/VV ᆫ/ETM 것/NNB 으로/JKB 추측/NNG 되/XSV ᆫ다/EF ./SF
1102,실업자/NNG 생활/NNG 3/SN 개월/NNB 후__08/NNG 백화점/NNG 에서/JKB 가구__04/NNG 를/JKO 판매/NNG 하/XSV 는/ETM 데/NNB 뛰어들/VV 었/EP 다/EF ./SF
1103,집__01/NNG 에서/JKB 키우/VV ᆫ/ETM 머슴/NNG 을/JKO 사랑__01/NNG 하/XSV 았/EP 죠/EF ./SF
1104,그런데/MAJ 당신/NP 의/JKG 고향__02/NNG 이/JKS 있/VV 는/ETM 고국__02/NNG 땅/NNG 한국/NNP 에서/JKB 는/JX 조용/XR 하/XSA ᄇ니다/EF ./SF
1105,그/NP 의/JKG 음성__02/NNG 에서/JKB 수혜/NNP 는/JX 온수__02/NNG 의/JKG 따뜻/XR 하/XSA ᆫ/ETM 느낌/NNG 을/JKO 받__01/VV 았/EP 다/EF ./SF
1106,덕분/NNG 에/JKB 타지__01/NNG 에서/JKB 의/JKG 생활/NNG 이/JKS 외롭/VA 지/EC 않/VX 았/EP 다/EF ./SF
1107,즉/MAJ 개인__02/NNG 의/JKG 관점__02/NNG 에서/JKB 사회__07/NNG 를/JKO 바라보/VV 게/EC 되/VX 는/ETM 것/NNB 이/VCP 다/EF ./SF
1108,이/MM 이야기/NNG 의/JKG 주인공/NNG 은/JX 현재/MAG 과천/NNP 에서/JKB 살__01/VV 고/EC 있/VX 다/EF ./SF
1109,물론/MAG 이것/NP ᆫ/JX 꼭__03/MAG 부정__09/NNG 적/XSN 이/VCP ᆫ/ETM 의미/NNG 에서/JKB 하/VV 는/ETM 말__01/NNG 은/JX 아니/VCN 다/EF ./SF
1110,욕실/NNG 에서/JKB 는/JX 강/XR 하/XSA ᆫ/ETM 표백제/NNG 냄새/NNG 가/JKS 나/VV 았/EP 다/EF ./SF
1111,그런/MM 의미/NNG 에서/JKB 우리/NP 악수__06/NNG 한번/NNG 하/VV 자/EF ./SF "/SS
1112,자연__01/NNG 계/XSN 에서/JKB 항암/NNG 물질__02/NNG 을/JKO 발견__01/NNG 하/XSV 려는/ETM 노력__01/NNG 도/JX 기울이/VV 고/EC 있/VX 다/EF ./SF
1113,그/MM 기계__07/NNG 에서/JKB 음악__01/NNG 소리__01/NNG 가/JKS 흘러나오/VV 았/EP 습니다/EF ./SF
1114,늘/MAG 그/MM 지점__03/NNG 에서/JKB 남자__02/NNG 들/XSN 과/JC 나/NP 는/JX 갈라서/VV 었/EP 다/EF ./SF
1115,이런/MM 남자__02/NNG 중__04/NNB 에서/JKB 도대체/MAG 누구/NP 가/JKS '/SS 나/NP '/SS 에게/JKB 흥미/NNG 를/JKO 가지/VV 었었/EP 을까/EF ./SF
1116,최동식/NNP 은/JX 어둠/NNG 속__01/NNG 에서/JKB 싱긋/MAG 웃/VV 었/EP 다/EF ./SF
1117,이/NP 와/JKB 는/JX 또/MAJ 다른/MM 면__05/NNG 에서/JKB 사회__07/NNG 는/JX 변하/VV 아야/EC 하/VX ᆫ다/EF ./SF
1118,선생__01/NNG 님/XSN 옆/NNG 에서/JKB 노래__01/NNG 부르/VV 고/EC 싶/VX 어요/EF ./SF "/SS
1119,연애__05/NNG 의/JKG 그리움/NNG 과/JC 감미/NNG 가/JKS 결혼/NNG 에서/JKB 는/JX 의무__01/NNG 와/JC 평범/XR 으로/JKB 바뀌/VV ᆫ다/EF ./SF
1120,세일즈/NNG 세계__02/NNG 에서/JKB 사용__04/NNG 되/XSV 는/ETM '/SS 아이드/NNG 카스/NNG 의/JKG 법칙/NNG '/SS 이/JKS 있/VV 다/EF ./SF
1121,그리고/MAJ 지금__03/NNG 은/JX 펌/NNG 에서/JKB 파트너/NNG 가/JKC 되__01/VV 는/ETM 것/NNB 이/JKS 꿈__01/NNG 이/VCP 었/EP 다/EF ./SF
1122,금호생명/NNP 은/JX 올/MM 시즌/NNG 2/SN 승__12/NNB 을/JKO 모두/MAG 신세계전/NNG 에서/JKB 챙기/VV 었/EP 다/EF ./SF
1123,아마/MAG 광주/NNP 에서/JKB 가장__01/MAG 규모/NNG 있/VV 는/ETM 대중__02/NNG 사우나/NNG 중__04/NNB 하나/NR 이/VCP ᆯ/ETM 거/NNB 이/VCP 에요/EF ./SF
1124,초가을/NNG 의/JKG 햇살/NNG 마저/JX 도/JX 그/MM 선창머리/NNG 에서/JKB 는/JX 을씨년스럽/VA 었/EP 다/EF ./SF
1125,북한/NNP 에서/JKB 는/JX 흔하/VA ᆫ/ETM 여름새/NNG 이/VCP 다/EF ./SF
1126,발리/NNP 에서/JKB 이루어지/VV 는/ETM 화장__05/NNG 장례식/NNG 이/VCP 에요/EF ./SF
1127,나/NP 는/JX 아크로폴리스/NNP 에서/JKB 도/JX 갈증/NNG 에/JKB 시달리/VV 었/EP 다/EF ./SF
1128,"/SS 이/MM 녀석/NNB ,/SP 우물가/NNG 에서/JKB 숭늉/NNG 찾/VV 는/ETM 버릇__01/NNG 은/JX 여전/XR 하/XSA 구나/EF ./SF "/SS
1129,이/MM 집착__02/NNG 에서/JKB 벗어나/VV 아야/EC 겠/EP 다고/EC 결심__01/NNG 하/XSV 았/EP 다/EF ./SF
1130,바닷가/NNG 에서/JKB 태진이/NNP 가/JKS 기다리__01/VV 고/EC 있/VX 었/EP 습니다/EF ./SF
1131,이/MM 중__04/NNB 어느/MM 단계__03/NNG 에서/JKB 예금__01/NNG 계약/NNG 이/JKS 성립/NNG 하/XSV 게/EC 되__01/VV 는지/EC 의문__02/NNG 이/VCP 다/EF ./SF
1132,우리__01/NNG 속__01/NNG 에서/JKB ᆫ/JX 아무/MM 가치__06/NNG 도/JX 없/VA 는/ETM 이빨/NNG 이/VCP 니까/EF ./SF "/SS
1133,이런/MM 곳__01/NNG 에서/JKB 공부__01/NNG 안/MAG 하/VV 면/EC 그것/NP 이/JKS '/SS 죄__03/NNG '/SS 이/VCP 죠/EF ./SF "/SS
1134,포옹/NNG 하/XSV 는/ETM 씬/NNG 에서/JKB 바람__01/NNG 이/JKS 불__01/VV 었/EP 어/EF ./SF
1135,며칠/NNG 전__08/NNG 인천/NNP 에서/JKB 난초__03/NNG 화분__01/NNG 이/JKS 동__88/NNG 이/JKS 나/VV 았/EP 다는/ETM 소식__04/NNG 이/VCP 다/EF ./SF
1136,동물/NNG 중__04/NNB 에서/JKB 내/NP 가/JKS 제/XPN 일/NR 좋아하/VV 는/ETM 동물/NNG 은/JX 아옹이/NNP 와/JC 노랭이/NNP 이/VCP ᄇ니다/EF ./SF
1137,그때/NNG 도/JX 초등학교/NNG 에서/JKB 는/JX 일/NR 년__02/NNB 에/JKB 한두/MM 번/NNB 씩/XSN 학부형회/NNG 를/JKO 하/VV 았/EP 다/EF ./SF
1138,간첩/NNG 사건__01/NNG 은/JX 남조선/NNP 에서/JKB 자생__02/NNG 적/XSN 으로/JKB 일어나/VV ᆫ/ETM 사건__01/NNG 이/VCP 라는/ETM 거/NNB 이/VCP 야/EF ./SF
1139,그리고/MAJ 여기/NP 에서/JKB 공자/NNP 가/JKS 얻/VV 은/ETM 해답/NNG 이/VCP 었/EP 던/ETM 것/NNB 이/VCP ᄇ니다/EF ./SF
1140,그곳/NP 에서/JKB 일__01/NNG 하/XSV 는/ETM 동양인/NNG 이/VCP 라고/EC 는/JX 혼자__01/NNG 밖에/JX 없/VA 었/EP 다/EF ./SF
1141,기성회/NNG -/SS 육성회/NNG 도/JX 분교장/NNG 에서/JKB 독자__03/NNG 적/XSN 으로/JKB 하/VV 는/ETM 모양__02/NNG 이/VCP 다/EF ./SF
1142,이/MM 세상__01/NNG 에서/JKB 가장__01/MAG 빠르/VA ᆫ/ETM 새__03/NNG 는/JX ?/SF
1143,마음__01/NNG 의/JKG 불길/NNG 속__01/NNG 에서/JKB 자기/NP 들/XSN 을/JKO 잃어버리/VV ᆫ/ETM 사람/NNG 들/XSN 이여/JKV !/SF
1144,전쟁/NNG 에서/JKB 이기__01/VV ᆫ/ETM 고구려/NNP 는/JX …/SE …/SE "/SS
1145,그런데/MAJ 다행히/MAG 도/JX 옆/NNG 집__01/NNG 에서/JKB 감나무/NNG 한/MM 그루/NNB 를/JKO 가져오/VV 았/EP 다/EF ./SF
1146,오늘/NNG 밤__01/NNG 은/JX 쇤네/NP 의/JKG 집__01/NNG 에서/JKB 묵어가/VV 아야/EC 하/VX 시/EP ᄇ니다/EF ./SF "/SS
1147,'/SS 공장__02/NNG 에서/JKB ᆫ/JX 운동__02/NNG 만/JX 잘/MAG 하/XSV 면/EC 오/VV 았/EP 다야/EF ./SF
1148,그리고/MAJ 곳곳/NNG 에서/JKB 이루__01/VV 어/EC 지/VX 는/ETM 매매춘/NNG 현장/NNG 을/JKO 생생/XR 하/XSA 게/EC 묘사__02/NNG 하/XSV ᆫ다/EF ./SF
1149,8/SN 회/NNB 2/SN 사후__01/NNG 유지현/NNP 과/JC 김재현/NNP 에게/JKB 연속__02/NNG 안타__01/NNG 맞__03/VV 고/EC 만루/NNG 에서/JKB 강판__02/NNG ./SF
1150,애__02/NNG 들/XSN 입장__04/NNG 에서/JKB 도/JX 그렇/VA 어요/EF ./SF
1151,어머니/NNG 는/JX 그/MM 즈음/NNB 에/JKB 이문/NNP 3/SN 동__12/NNG 의/JKG 판자촌/NNG 에서/JKB 살__01/VV 고/EC 있/VX 었/EP 다/EF ./SF
1152,읍내/NNG 에/JKB 들어오/VV 기/ETN 조금/MAG 전__08/NNG 에/JKB 우리/NP 는/JX 방죽__01/NNG 위__01/NNG 에서/JKB 키스/NNG 하/XSV 았/EP 다/EF ./SF
1153,이제/MAG 자주__03/NNG 이/VCP 냐/EC 동맹__01/NNG 이/VCP 냐/EC 의/JKG 이분법/NNG 에서/JKB 벗어나/VV 야/EC 하/VX ᄇ니다/EF ./SF
1154,나/NP 의/JKG 집__01/NNG 에서/JKB 아이__01/NNG 들/XSN 둘/NR 이/JKS 잠자/VV 고/EC 있/VX 다/EF ./SF
