Number,Sentence
757,낙심/NNG 춘기/NNP 다시/MAG 집__01/NNG (으)로/JKB 돌아오/VV
758,오히려/MAG 반대__03/NNG 방향__01/NNG 민중/NNG 쪽__05/NNB (으)로/JKB 가/VV
759,내/NP 시골/NNG (으)로/JKB 내려가/VV 것/NNB 년__02/NNB 초__03/NNB
760,그녀/NP 바다/NNG 쪽__05/NNB (으)로/JKB 몸__01/NNG 돌리__04/VV
761,아래층/NNG 화실__04/NNG (으)로/JKB 내려가/VV
762,나/NP 오늘/MAG 그냥/MAG 뒤__01/NNG (으)로/JKB 돌아가/VV
763,지하철/NNG 역__14/NNG 쪽__05/NNB (으)로/JKB 한동안/NNG 더/MAG 말없이/MAG 걷__02/VV
764,그/NP 발길/NNG 왼쪽/NNG (으)로/JKB 돌리__04/VV
765,준태/NNP 뻐드렁이/NNG 사무실/NNG (으)로/JKB 들어서/VV
766,무왕/NNP 선화공주/NNP 함께/MAG 사자사/NNP (으)로/JKB 가/VV 길__01/NNG
767,호__14/NNB 지석묘/NNG 동쪽/NNG (으)로/JKB 떨어지/VV
768,거기/NP (으)로/JKB 가/VV
769,다음__01/NNG 다/MAG 자기/NP 집__01/NNG (으)로/JKB 돌아가/VV
770,미리/MAG 금시/NNG 커피/NNG 현실__02/NNG (으)로/JKB 돌아오/VV
771,서당__01/NNG 아이__01/NNG 밖/NNG (으)로/JKB 뛰어나가/VV
772,박/NNP 기자__05/NNG 부대__08/NNG 마을__01/NNG (으)로/JKB 쳐들어가/VV
773,병원__02/NNG (으)로/JKB 가/VV
774,나/NP 천천히/MAG 집__01/NNG 앞/NNG (으)로/JKB 걸어가/VV
775,이제/MAG 나/NP 자신__01/NNG (으)로/JKB 시선__03/NNG 돌리__04/VV
776,김/NNP 형사__02/NNG 오/NNP 반장__08/NNG (으)로/JKB 다가오/VV 말__01/NNG
777,아침/NNG 봉고__88/NNG 차__06/NNG 동네/NNG (으)로/JKB 데리/VV
778,마음__01/NNG 진정__15/NNG 동진이/NNP 겨우/MAG 교실/NNG (으)로/JKB 들여보내/VV
779,성진/NNP 여자__02/NNG 남자__02/NNG 쪽__05/NNB (으)로/JKB 떠밀/VV
780,이재필/NNP 새끼__02/NNG 덧문/NNG 밖/NNG (으)로/JKB 밀어내/VV
781,이제/MAG 열기__07/NNG 노래방/NNG (으)로/JKB 옮기/VV
782,나/NP 말__01/NNG 없이/MAG 골목__01/NNG 안__01/NNG (으)로/JKB 들어가__01/VV
783,그녀/NP 급기야/MAG 나/NP 꿈속/NNG (으)로/JKB 들어오/VV
784,모두__01/NNG 우르르__01/MAG 마당/NNG (으)로/JKB 나가/VV
785,결국/NNG 원점__01/NNG (으)로/JKB 돌아오/VV
786,조바심__01/NNG 그만/MAG 변소/NNG 앞/NNG (으)로/JKB 오/VV
787,그리고/MAJ 왜곡/NNG 방향__01/NNG (으)로/JKB 해소책/NNG 찾/VV
788,창가__01/NNG 자리__01/NNG (으)로/JKB 수혜/NNP 안내__01/NNG 남자__02/NNG 묻__03/VV
789,아버지/NNG 어머니/NNG 나/NP 곁/NNG (으)로/JKB 날아오/VV
790,그녀/NP 손__01/NNG 그/NP 얼굴/NNG (으)로/JKB 올라오/VV
791,남쪽/NNG (으)로/JKB 가/VV 풍경__01/NNG 완연히__02/MAG 여름__01/NNG
792,나/NP 선택/NNG 나/NP 여기/NP (으)로/JKB 데려오/VV
793,머리__01/NNG 쪽__05/NNB (으)로/JKB 물__01/NNG 고이__01/VV
794,자네/NP 지금__03/MAG 어디/NP (으)로/JKB 가/VV
795,우리/NP 모두/MAG 계곡/NNG (으)로/JKB 내려가/VV
796,개똥이/NNP 앞/NNG (으)로/JKB 다가서/VV
797,나/NP 그/NP 청요리집/NNG (으)로/JKB 들어가__01/VV
798,어서/MAG 자리__01/NNG (으)로/JKB 앉/VV
799,나/NP 조심__02/NNG 집__01/NNG 안__01/NNG (으)로/JKB 들어서/VV
800,이경아/NNP 씨/NNB 안__01/NNG (으)로/JKB 들어가__01/VV
801,데/NNB (으)로/JKB 가/VV
802,나/NP 승강구/NNG 아랫계단/NNG 위__01/NNG (으)로/JKB 올라서/VV
803,순간__03/NNG 성호/NNP 얼굴/NNG 텔레비전/NNG 앞/NNG (으)로/JKB 쑥/MAG 빼__01/VV
804,역사__04/NNG 앞/NNG (으)로/JKB 진보__02/NNG 하/VV 것/NNB
805,차/NNB 대전__07/NNG 후__08/NNG 뉴욕/NNP (으)로/JKB 거처__02/NNG 옮기/VV
806,그/NP 주춤/MAG 뒤__01/NNG (으)로/JKB 물러서/VV
807,오누이/NNG 얼른/MAG 앞문/NNG 쪽__05/NNB (으)로/JKB 오/VV
808,우리/NP 집__01/NNG (으)로/JKB 보내/VV
809,베쓰/NNP 그만/MAG 집__01/NNG (으)로/JKB 오/VV
810,사람/NNG 말없이/MAG 터미널/NNG 밖/NNG (으)로/JKB 걸어가/VV
811,우리/NP 다시/MAG 번/NNB 서랍/NNG (으)로/JKB 돌아가/VV
812,아씨/NNG 마님/NNG 친정__04/NNG 어디/NP (으)로/JKB 부르/VV
813,혼불/NNG 불__01/NNG 허공/NNG 속__01/NNG (으)로/JKB 날아가/VV
814,남녀/NNG 이제__01/NNG 집__01/NNG (으)로/JKB 가/VV 모양__02/NNG
815,소형__03/NNG 영구차/NNG 뒤__01/NNG (으)로/JKB 빠지__01/VV 방송__01/NNG 시작/NNG
816,아기__01/NNG (으)로/JKB 돌아앉/VV
817,어디/NP (으)로/JKB 가/VV 그/NP
818,숙부__01/NNG 계속/MAG 방첩대/NNG 지하실/NNG (으)로/JKB 찾아오/VV 권유__02/NNG
819,아이__01/NNG 현관__01/NNG 밖/NNG 마당/NNG (으)로/JKB 쫓아내/VV
820,다시/MAG 처음/NNG 어귀__01/NNG (으)로/JKB 돌아가/VV
821,그/NP 얼른/MAG 아래층/NNG (으)로/JKB 뛰어내리/VV
822,여자__02/NNG 남자__02/NNG 배__02/NNG (으)로/JKB 올라가/VV
823,우리/NP 시장__04/NNG 안__01/NNG 해장국/NNG 집__01/NNG (으)로/JKB 들어가__01/VV
824,그러므로/MAJ 인터뷰/NNG 내용__02/NNG 주로/MAG 방향__01/NNG (으)로/JKB 맞추/VV
825,간염/NNG 환자__03/NNG 왜/MAG 여기/NP (으)로/JKB 오/VV
826,순간__03/NNG 이인국/NNP 박사__01/NNG 방__07/NNG 쪽__05/NNB (으)로/JKB 머리__01/NNG 홱/MAG 돌리__04/VV
827,대문__03/NNG 쪽__05/NNB (으)로/JKB 돌아가/VV
828,직각__03/NNG 사방__03/NNG (으)로/JKB 흩어지/VV 시작__01/NNG
829,어디/NP (으)로/JKB 가/VV
830,병원__02/NNG (으)로/JKB 옮기/VV
831,뒤__01/NNG (으)로/JKB 형사__02/NNG 달려들/VV
832,귀__01/NNG 가게/NNG 안쪽/NNG (으)로/JKB 기울이/VV
833,위__01/NNG (으)로/JKB 누나/NNG 분__01/NNB 있/VV
834,그리고/MAJ 어슬렁어슬렁/MAG 객줏집/NNG (으)로/JKB 돌아오/VV
835,루이/NNP 도로/MAG 파리/NNP (으)로/JKB 불러들이/VV
836,그래서/MAJ 무시__04/NNG 그냥/MAG 호텔/NNG 안__01/NNG (으)로/JKB 들어오/VV
837,그녀/NP 거기/NP 동익/NNP 집__01/NNG (으)로/JKB 전화__07/NNG 걸__02/VV
838,그래서/MAJ 강원도/NNP 골짜기__01/NNG (으)로/JKB 기어들/VV
839,나/NP 그녀/NP 뒤꼍/NNG (으)로/JKB 데려가/VV 말__01/NNG
840,훈/NNP 빨리/MAG 집__01/NNG (으)로/JKB 돌아가/VV
841,원산/NNP 수송선__01/NNG (으)로/JKB 피난/NNG 오/VV 것/NNB
842,그녀/NP 욕실/NNG (으)로/JKB 들어가__01/VV
843,노마/NNP 할머니/NNG 곁/NNG (으)로/JKB 파고들/VV 이야기/NNG 재촉/NNG
844,밖/NNG (으)로/JKB 나오/VV
845,안__01/NNG (으)로/JKB 당기__01/VV 울음소리/NNG
846,일출__01/NNG 일몰/NNG 반대__03/NNG 방향__01/NNG (으)로/JKB 일어나/VV
847,순금이/NNP 순진이/NNP 따라서/MAJ 부엌문/NNG 뒤__01/NNG (으)로/JKB 숨__01/VV
848,주사__02/NNG 과장__01/NNG 앞/NNG (으)로/JKB 그/NP 데려가/VV
849,어디/NP (으)로/JKB 가/VV
850,나/NP 비명__02/NNG 꿈__01/NNG 밖/NNG (으)로/JKB 뛰쳐나가/VV
851,북쪽/NNG (으)로/JKB 하늘/NNG 괴__03/VV 듯/NNB 무악산/NNP
852,저쪽/NP 우리/NP 고아원/NNG (으)로/JKB 연락__02/NNG 오/VV
853,우리/NP 곧장/MAG 수돗가/NNG (으)로/JKB 달려가/VV
854,다리__02/NNG 위__01/NNG (으)로/JKB 누구/NP 넘어가__01/VV
855,저/NP 이쪽/NP (으)로/JKB 가/VV
856,이어서/MAG 도읍/NNG 아사달/NNP (으)로/JKB 옮기/VV
857,그러나/MAJ 톨/NNB 나락__01/NNG 누구/NP 입/NNG (으)로/JKB 들어가__01/VV
858,이내/MAG 산__01/NNG (으)로/JKB 들어서/VV
859,그제서야/MAG 그/NP 쪽__05/NNB (으)로/JKB 고개__01/NNG 돌리__04/VV
860,윤/NNP 서방__02/NNG 눈길__01/NNG 그/NP 얼굴/NNG (으)로/JKB 날아오/VV
861,사람/NNG 뒷길__01/NNG (으)로/JKB 걷__02/VV
862,방고래/NNG 밑__01/NNG (으)로/JKB 뿌리/NNG 뻗/VV 집안__01/NNG
863,미애/NNP (으)로/JKB 옮기/VV 시선__03/NNG
864,눈길__01/NNG 벽__06/NNG 쪽__05/NNB (으)로/JKB 던지/VV
865,버스__02/NNG 남쪽/NNG (으)로/JKB 달리__04/VV
866,내일/NNG 오하이오/NNP (으)로/JKB 떠나/VV
867,제발/MAG 저/NP 좀/MAG 홍보실/NNG (으)로/JKB 데려가/VV
868,사진__07/NNG 그냥/MAG 그/NP (으)로/JKB 오/VV 것/NNB
869,그리고/MAJ 또다시/MAG 곳__01/NNG (으)로/JKB 이사__14/NNG 가/VV 거/NNB
870,그녀/NP 문__05/NNG 안쪽/NNG (으)로/JKB 몸__01/NNG 빼__01/VV
871,유지/NNP 이중__03/NNG 플레이/NNG 유지/NNP 그쪽/NP (으)로/JKB 몰아가/VV
872,황제__02/NNG 왕궁/NNG (으)로/JKB 돌아오/VV
873,어디/NP (으)로/JKB 가/VV
874,윤건/NNP 다시/MAG 모교__01/NNG 고보__04/NNG (으)로/JKB 찾아가/VV
875,드디어/MAG 산__01/NNG 위__01/NNG (으)로/JKB 올라서/VV
876,나/NP 마음__01/NNG 갈래/NNG 길__01/NNG (으)로/JKB 동시__02/NNG 가/VV
877,나/NP 쪽__05/NNB (으)로/JKB 귀__01/NNG 기울이/VV
878,이제/MAG 그녀/NP (으)로/JKB 향하/VV 여행__02/NNG 시작__01/NNG
879,천막/NNG 밖/NNG (으)로/JKB 나오/VV
880,그/NP 공터/NNG (으)로/JKB 나서/VV
881,윤길수/NNP 미국/NNP (으)로/JKB 등벽/NNG 원정__13/NNG 가/VV
882,술집/NNG 여자__02/NNG 여관__03/NNG (으)로/JKB 들어가__01/VV 남자__02/NNG 말__01/NNG
883,휴양원/NNG (으)로/JKB 되돌아오/VV
884,앞/NNG (으)로/JKB 가/VV
885,눈__01/NNG 창공__02/NNG (으)로/JKB 돌리__04/VV
886,우리/NP 경복궁/NNP 안__01/NNG (으)로/JKB 들어가__01/VV
887,그/NP 전체__01/NNG 저/NP 전체__01/NNG 안__01/NNG (으)로/JKB 들어오/VV
888,그/NP 밖/NNG (으)로/JKB 나오/VV
889,담배/NNG 연기__09/NNG 폐__02/NNG 속__01/NNG (으)로/JKB 스며들/VV
890,먼저/MAG 차나칼레/NNP 도시__03/NNG (으)로/JKB 가/VV
891,망원경/NNG 바닥__01/NNG (으)로/JKB 떨어지/VV 때문/NNB
892,신사__11/NNG (으)로/JKB 가/VV
893,차__06/NNG 둑__01/NNG 위__01/NNG (으)로/JKB 올라서/VV
894,순간__03/NNG 설움/NNG 풍경__01/NNG 전체__01/NNG (으)로/JKB 다가오/VV
895,내일/NNG 목바이/NNP (으)로/JKB 향하/VV
896,영달/NNP 포항/NNP (으)로/JKB 가/VV
897,상덕/NNP 동욱/NNP 쪽__05/NNB (으)로/JKB 달려가/VV
898,서재__02/NNG (으)로/JKB 쥐__02/NNG 들어가__01/VV
899,나/NP 얼른/MAG 랜턴/NNG 곳__01/NNG (으)로/JKB 옮기/VV
900,난데없이/MAG 너/NP 안__01/NNG (으)로/JKB 질투/NNG 감정__06/NNG 몰아치/VV
901,저희/NP 집__01/NNG (으)로/JKB 가/VV
902,내일/NNG 시/NNB 분__08/NNB 똔레삽호수/NNP (으)로/JKB 가/VV
903,좌회전/NNG 경남아파트/NNP 쪽__05/NNB (으)로/JKB 달려가/VV
904,고승우/NNP 부두__01/NNG 쪽__05/NNB (으)로/JKB 방향__01/NNG 잡__01/VV
905,시간__04/NNG 후__08/NNG 지서__02/NNG (으)로/JKB 오/VV
906,거래소/NNG (으)로/JKB 이전__08/NNG 우리/NP 맡기/VV
907,나/NP 순자/NNP 방__07/NNG (으)로/JKB 끌려가/VV
908,자형__04/NNG 밥통/NNG 나/NP 앞/NNG (으)로/JKB 밀__01/VV
909,나/NP 개울가/NNG (으)로/JKB 가/VV
910,백지연/NNP 이달__01/NNG 말__11/NNB 영국/NNP 옥스퍼드대/NNP (으)로/JKB 유학__04/NNG 떠나/VV
911,어디/NP (으)로/JKB 가/VV
912,그럼/MAJ 그쪽/NP (으)로/JKB 수사__18/NNG 방향__01/NNG 잡__01/VV
913,호텔/NNG 옆/NNG 골목__01/NNG (으)로/JKB 들어서/VV
914,이만기/NNP 뒤__01/NNG (으)로/JKB 밀려나/VV
915,셋/NR 힘없이/MAG 정류장/NNG 쪽__05/NNB (으)로/JKB 걷__02/VV
916,의경__01/NNG 대부분/NNG 아마/MAG 여기/NP (으)로/JKB 몰리__01/VV 것/NNB
917,그/NP 음성__02/NNG 차츰/MAG 입속/NNG (으)로/JKB 숨어들/VV
918,덕호/NNP 선비/NNP 앞/NNG (으)로/JKB 조금/MAG 다가서/VV
919,모두/MAG 객실/NNG (으)로/JKB 올라가/VV
920,이곳/NP (으)로/JKB 다시/MAG 돌아오/VV
921,그리고/MAJ 어제__01/NNG 저녁/NNG 실비아/NNP 나/NP 숙소__02/NNG (으)로/JKB 찾아오/VV
922,며칠/NNG 뒤__01/NNG 그녀/NP 산__01/NNG (으)로/JKB 데리/VV
923,그리고/MAJ 시선__03/NNG 그쪽/NP (으)로/JKB 돌리__04/VV 여기/NP 탈출__02/NNG
924,그/NP 술집/NNG 앞/NNG (으)로/JKB 달려가/VV
925,파니/NNP 핑크/NNG 다시/MAG 앞/NNG (으)로/JKB 돌리__04/VV
926,일제히/MAG 시선__03/NNG 나/NP (으)로/JKB 쏟아지/VV
927,그/NP 어디/NP (으)로/JKB 가/VV 것/NNB
928,김/NNP 형사__02/NNG 옆/NNG 형사__02/NNG 춘기/NNP 옆/NNG (으)로/JKB 걸어오__01/VV
929,눈동자/NNG 열심히/MAG 전후좌우/NNG (으)로/JKB 굴리/VV
930,나라/NNG 문화__01/NNG 어디/NP (으)로/JKB 가/VV 것/NNB
931,그/NP 다시/MAG 생각__01/NNG 속__01/NNG (으)로/JKB 잠기__02/VV 듯/NNB
932,이/NR 층__02/NNG (으)로/JKB 올라가/VV
933,우리/NP 셋/NR 경찰서/NNG (으)로/JKB 연행__01/NNG 되__01/VV
934,영구/NNP 어머니/NNG 밤__01/NNG 범일동/NNP (으)로/JKB 나가/VV
935,정신__12/NNG 어디/NP (으)로/JKB 움직이/VV 것/NNB
936,소주병/NNG 방__07/NNG 지천__05/NNG (으)로/JKB 널리__01/VV
937,마야게즈/NNP 호__x19/NNG 꼬땅/NNP (으)로/JKB 끌려가/VV
938,그래서/MAJ 나/NP 한약방/NNG (으)로/JKB 다시/MAG 발길/NNG 돌리__04/VV
939,옥점/NNP 어머니/NNG 안방__02/NNG (으)로/JKB 들어오/VV
940,쪽__05/NNB 멕시코만/NNP (으)로/JKB 들어가__01/VV
941,사원__02/NNG 뒤__01/NNG (으)로/JKB 다시/MAG 주택가/NNG 골목__01/NNG 이어지/VV
942,선거__04/NNG 결과__02/NNG 당__14/NNG 지도부/NNG 충격__02/NNG 속__01/NNG (으)로/JKB 몰아넣/VV
943,우리/NP 뻔질나게/MAG 하숙방/NNG (으)로/JKB 달려가/VV
944,나/NP 공장__02/NNG (으)로/JKB 다가가/VV
945,오/NNP 반장__08/NNG 즉시/MAG 집__01/NNG (으)로/JKB 달려가/VV
946,오후__02/NNG 친정__04/NNG (으)로/JKB 재양__88/NNG 보내/VV
947,옷/NNG 자체__02/NNG 다/MAG 같이/MAG 무릎/NNG 위__01/NNG (으)로/JKB 올라오/VV
948,노랫소리/NNG 점점/MAG 나/NP 창가__01/NNG (으)로/JKB 다가오/VV
949,그/NP 변솟간/NNG (으)로/JKB 들어가__01/VV
950,사랑__01/NNG 그대/NP 갠지스/NNP 강가__01/NNG 풀밭/NNG (으)로/JKB 가/VV
951,그/NP 다시/MAG 대전역/NNP (으)로/JKB 되돌아가/VV
952,그리고/MAJ 보통/MAG 장안/NNP 날__01/NNG 송파/NNP (으)로/JKB 돌아오/VV
953,지금__03/NNG 보다/MAG 사건__01/NNG 핵심부/NNG (으)로/JKB 들어가__01/VV
954,나/NP 겨우/MAG 효순/NNP 어머니/NNG 쪽__05/NNB (으)로/JKB 시선__03/NNG 돌리__04/VV
955,조미곤/NNP 곧/MAG 신라/NNP (으)로/JKB 돌아가/VV
956,엄마/NNG 어디/NP (으)로/JKB 가/VV 얘기/NNG
957,동시__02/NNG 오른쪽/NNG (으)로/JKB 방향__01/NNG 틀/VV
958,그래서/MAJ 도리어/MAG 밖/NNG (으)로/JKB 자연__01/NNG 퍼지/VV
959,어머니/NNG 벌써/MAG 며칠/NNG 전__08/NNG 대구/NNP (으)로/JKB 가/VV
960,순간__03/NNG 클레오파트라/NNP 다비/NNP (으)로/JKB 돌아오/VV
961,우리/NP 계속__04/NNG 북서쪽/NNG (으)로/JKB 올라가/VV
962,나/NP 일방__01/NNG (으)로/JKB 당하/VV
963,청웅/NNP (으)로/JKB 대회__02/NNG 나가/VV
964,갑자기/MAG 한기__03/NNG 명치끝/NNG (으)로/JKB 어슬어슬__88/MAG 몰려오/VV
965,나/NP 온몸/NNG 피__02/NNG 머리__01/NNG (으)로/JKB 끓어오르/VV
966,박/NNP 기자__05/NNG 일/NR 먼저/MAG 연천/NNP (으)로/JKB 달려가/VV
967,나비__03/NNG 다시/MAG 북쪽/NNG (으)로/JKB 떠나가/VV
968,포항/NNP (으)로/JKB 가/VV
969,상대__04/NNG 거리낌/NNG 없이/MAG 마당/NNG (으)로/JKB 들어서/VV
970,주인__01/NNG 그/NP 어깨너머/NNG (으)로/JKB 왼손/NNG 들이밀__02/VV
971,최/NNP 의사__12/NNG 아래층/NNG (으)로/JKB 급히/MAG 내려가/VV
972,엄마/NNG 지금__03/MAG 방__07/NNG (으)로/JKB 들어가__01/VV
973,그쪽/NP (으)로/JKB 애__02/NNG 더/MAG 풀/VV
974,민박/NNG 집__01/NNG (으)로/JKB 돌아가/VV 사람/NNG
975,그래서/MAJ 박/NNP 기자__05/NNG 느티나무/NNG 아래__01/NNG (으)로/JKB 들어서/VV
976,사바세계/NNG (으)로/JKB 내려가/VV 것/NNB
977,내/NP 시무룩히/MAG 사무실/NNG (으)로/JKB 들어가__01/VV
978,어디/NP (으)로/JKB 가/VV
979,번/NNB 아버지/NNG 골방/NNG (으)로/JKB 찾아오/VV
980,그/NP 백인__01/NNG 쪽__05/NNB (으)로/JKB 슈팅/NNG 날리__02/VV
981,논__01/NNG 논__01/NNG 논__01/NNG (으)로/JKB 끝없이/MAG 이어지/VV
982,집__01/NNG (으)로/JKB 가/VV
983,이쪽/NP (으)로/JKB 앉/VV 선생__01/NNG
984,우리/NP 선택/NNG 여지/NNB 없이/MAG 그곳/NP 알렌비/NNP 국경__01/NNG (으)로/JKB 가/VV
985,그녀/NP 나/NP 빗줄기/NNG 속__01/NNG (으)로/JKB 들어서/VV
986,오빠/NNG 방__07/NNG (으)로/JKB 가/VV
987,집__01/NNG 주변__04/NNG 들/NNG (으)로/JKB 나가/VV
988,일단/MAG 평양/NNP (으)로/JKB 가/VV 생각__01/NNG
989,최/NNP 서방__02/NNG 집__01/NNG 개__03/NNG 이리_x04/NNG (으)로/JKB 오/VV
990,양조장/NNG 안집__01/NNG (으)로/JKB 달려가/VV
991,그때/NNG 터__01/NNG 초입__01/NNG (으)로/JKB 불쑥/MAG 엿장수/NNG 하나/NR 나타나/VV
992,해숙/NNP 사람/NNG 사이__01/NNG (으)로/JKB 파고들/VV
993,동준/NNP 테이블/NNG 위__01/NNG (으)로/JKB 손__01/NNG 뻗/VV
994,집안__01/NNG (으)로/JKB 들어가__01/VV 사람/NNG 중__04/NNB 명/NNB
995,막__01/MAG 분장실/NNG (으)로/JKB 걸음/NNG 옮기/VV 그녀/NP
996,우리/NP 룩소르/NNP (으)로/JKB 가/VV
997,우리/NP 거의/MAG 역__14/NNG 구내__04/NNG (으)로/JKB 들어오/VV
998,벌써/MAG 스무날/NNG 나/NP 저녁/NNG 이곳/NP (으)로/JKB 찾아들/VV
999,집__01/NNG 어디/NP (으)로/JKB 정하__03/VV
1000,주제__04/NNG 여자__02/NNG (으)로/JKB 눈길__01/NNG 돌리__04/VV
1001,오른쪽/NNG 회랑/NNG (으)로/JKB 걸음/NNG 옮기/VV
1002,그리고/MAJ 아래__01/NNG (으)로/JKB 머리__01/NNG 들이밀__02/VV
1003,그/NP 조금__01/NNG 사양__05/NNG 없이/MAG 우리/NP 방__07/NNG (으)로/JKB 오/VV
1004,건물__03/NNG 밖/NNG (으)로/JKB 나오/VV 새벽바람/NNG
1005,바로/MAG 그때/NNG 언덕/NNG 아래__01/NNG (으)로/JKB 사람/NNG 걸어가/VV
1006,소년/NNG 대답/NNG 없이/MAG 축대/NNG (으)로/JKB 내려서/VV
1007,훈아/NNP 방__07/NNG 안__01/NNG (으)로/JKB 들어가__01/VV
1008,속__01/NNG (으)로/JKB 들어가__01/VV
1009,집__01/NNG (으)로/JKB 돌아오/VV
1010,어서/MAG 방__07/NNG (으)로/JKB 들어가__01/VV
1011,바다/NNG (으)로/JKB 데려가/VV
1012,집안__01/NNG (으)로/JKB 들어가__01/VV 사람/NNG 중__04/NNB 명/NNB
1013,우선/MAG 병원__02/NNG (으)로/JKB 가/VV
1014,저/NP 바깥/NNG (으)로/JKB 나오/VV
1015,규식/NNP 분식__04/NNG 센타/NNG (으)로/JKB 등__01/NNG 밀__01/VV
1016,빵집/NNG (으)로/JKB 들어가__01/VV
1017,그/NP 고향__02/NNG 포구__03/NNG (으)로/JKB 다시/MAG 돌아오/VV
1018,문희/NNP 당장/MAG 그/NP 하숙집/NNG (으)로/JKB 달려가/VV
1019,태길/NNP 빨리/MAG 고아원/NNG (으)로/JKB 가/VV
1020,여자__02/NNG 펄__01/NNG 속__01/NNG (으)로/JKB 벌렁/MAG 나동그라지/VV
1021,낮/NNG 외출/NNG 밤__01/NNG 집__01/NNG (으)로/JKB 돌아오/VV
1022,시내__03/NNG (으)로/JKB 가/VV
1023,시/NNB 제과점/NNG (으)로/JKB 나오/VV
1024,그러나/MAJ 떡집/NNG 벌써/MAG 이쪽/NNG (으)로/JKB 던지/VV
1025,베쓰/NNP 시장__04/NNG 안__01/NNG (으)로/JKB 들어가__01/VV
1026,하루빨리/MAG 어디/NP (으)로/JKB 달아나/VV 마음__01/NNG
1027,수사관/NNG 생각__01/NNG 자연/MAG 그쪽/NP (으)로/JKB 뻗/VV
1028,번/NNB 너/NP 저기/NP 문선조/NNG (으)로/JKB 가/VV 일__01/NNG
1029,민홍/NNP 고개__01/NNG 외_x04/NNG (으)로/JKB 꼬/VV
1030,나/NP 동료/NNG 교사__09/NNG 되도록/MAG 앞/NNG (으)로/JKB 가/VV
1031,누나/NNG 동생__01/NNG 얼른/MAG 뒷문/NNG 쪽__05/NNB (으)로/JKB 가/VV
1032,태진이/NNP 머리__01/NNG 동수/NNP 턱밑/NNG (으)로/JKB 들이밀__02/VV
1033,민이/NNP 할아버지/NNG 곁/NNG (으)로/JKB 바싹__01/MAG 다가앉/VV
1034,가/VV 룩소르/NNP (으)로/JKB
1035,기차__01/NNG 어느덧/MAG 부산/NNP (으)로/JKB 접어들/VV
1036,그녀/NP 함께/MAG 여관__03/NNG (으)로/JKB 가/VV
1037,버스__02/NNG 무진/NNP 읍내/NNG (으)로/JKB 들어서/VV
1038,밖/NNG (으)로/JKB 나가/VV
1039,유/NNP 간사__06/NNG 서류__02/NNG 봉투__02/NNG 앞/NNG (으)로/JKB 당기__01/VV
1040,그렇지만/MAJ 방__07/NNG (으)로/JKB 제/NP 전화__07/NNG 자주/MAG 걸__02/VV
1041,나/NP 진덕이/NNP 같이/MAG 집__01/NNG (으)로/JKB 오/VV
1042,남__04/NNG 캐롤라이나/NNP (으)로/JKB 돌아가/VV
1043,상하__01/NNG 좌우__01/NNG (으)로/JKB 급히/MAG 눈알/NNG 굴리/VV
1044,진숙/NNP 남수/NNP 달음산/NNP (으)로/JKB 올라가/VV
1045,옥점이/NNP 가만히/MAG 건넌방/NNG (으)로/JKB 건너가/VV
1046,영구/NNP 부둣가/NNG (으)로/JKB 나오/VV
1047,바람__01/NNG 기압부/NNG 기압부/NNG (으)로/JKB 불__01/VV
1048,여자__02/NNG 나/NP 옆/NNG (으)로/JKB 몰려오/VV
1049,비바람/NNG 소년/NNG 얼굴/NNG (으)로/JKB 몰아치/VV
1050,소년/NNG 갈림길/NNG 아래쪽/NNG (으)로/JKB 가/VV
1051,새롬이/NNP 조용히/MAG 저/NP 방__07/NNG (으)로/JKB 가/VV
1052,나/NP 개골창/NNG 속__01/NNG (으)로/JKB 들어가__01/VV
1053,그리고/MAJ 문득/MAG 창__09/NNG 밖/NNG (으)로/JKB 고개__01/NNG 돌리__04/VV
1054,순이/NNP 부엌/NNG (으)로/JKB 따라오/VV 말__01/NNG
1055,나/NP 양동/NNP (으)로/JKB 천천히/MAG 걸어가/VV
1056,카이주아/NNP (으)로/JKB 가/VV
1057,저녁/NNG 댁/NNG (으)로/JKB 찾아뵙/VV
1058,이야기/NNG 듯이/NNB 방향__01/NNG (으)로/JKB 흘러가/VV
1059,효철/NNP 아버지/NNG 정면__01/NNG (으)로/JKB 바라보/VV
1060,북집/NNG 바깥/NNG 왼쪽/NNG (으)로/JKB 가량/NNB 실__01/NNG 뽑아내/VV
1061,비바람/NNG 가슴__01/NNG (으)로/JKB 파고들/VV
1062,베쓰/NNP 염소__01/NNG 울타리/NNG (으)로/JKB 뛰어가/VV
1063,들/NNG 가운데/NNG (으)로/JKB 나서/VV 윤/NNP 서방__02/NNG 말__01/NNG
1064,그/NP 현관__01/NNG 밖/NNG (으)로/JKB 달리__04/VV
1065,자네/NP 곧장/MAG 돌개/NNP (으)로/JKB 들어가__01/VV
1066,우쑤리이스끄/NNP 서쪽/NNG (으)로/JKB 떨어지/VV 지점__03/NNG
1067,화가__03/NNG 년__02/NNB 만__01/NNB 전시장/NNG (으)로/JKB 나서/VV
1068,데/NNB (으)로/JKB 가/VV
1069,낙심/NNG 그/NP 다시/MAG 서부__01/NNG (으)로/JKB 가/VV
1070,아버지/NNG 목소리/NNG 숲__01/NNG 어둠/NNG 속__01/NNG (으)로/JKB 천천히/MAG 스며들/VV
1071,서포리/NNP 바다/NNG (으)로/JKB 가/VV 육지__02/NNG 끝/NNG
1072,그래서/MAJ 작정__01/NNG 역__14/NNG (으)로/JKB 나가/VV 거/NNB
1073,똥벌레/NNG 밖/NNG 속__01/NNG (으)로/JKB 들어가__01/VV
1074,그리고/MAJ 그녀/NP 옆/NNG 자리__01/NNG (으)로/JKB 가/VV
1075,마당/NNG (으)로/JKB 뛰어들/VV 참/NNB
1076,그럼/MAJ 어디/NP (으)로/JKB 가/VV
1077,도심__04/NNG 곳__01/NNG (으)로/JKB 들어가__01/VV
1078,외/NNB 내__09/NNG (으)로/JKB 옮기/VV
1079,일본/NNP 어디/NP (으)로/JKB 가/VV 안__01/NNG 밖/NNG
1080,상민이/NNP 아저씨/NNG 얼른/MAG 그쪽/NP (으)로/JKB 다가가/VV
1081,경지/NNP 시선__03/NNG 저절로/MAG 베란다/NNG 너머/NNG (으)로/JKB 향하/VV
1082,안__01/NNG (으)로/JKB 들어가__01/VV
1083,자기/NP 방문__02/NNG 앞/NNG (으)로/JKB 걸어가/VV
1084,이번__01/NNG 쪽__05/NNB (으)로/JKB 가/VV
1085,발소리/NNG 수혜/NNP (으)로/JKB 점점/MAG 가까이/MAG 다가오/VV
1086,어쩌다/MAG 금녀/NNP 바깥/NNG (으)로/JKB 나오/VV
1087,침대__02/NNG 밑__01/NNG (으)로/JKB 발__01/NNG 내려놓/VV 수혜/NNP 말__01/NNG
1088,이제/MAG 어디/NP (으)로/JKB 가/VV
1089,현관문/NNG 위__01/NNG 아래__01/NNG (으)로/JKB 시트지/NNG 번/NNB 붙이/VV
1090,그리고/MAJ 학교/NNG (으)로/JKB 뛰어나가/VV
1091,누나/NNG 나/NP 한꺼번에/MAG 갈팡질팡/MAG 그곳/NP (으)로/JKB 달려가/VV
1092,마땅히/MAG 민중/NNG 쪽__05/NNB (으)로/JKB 넘어오/VV 운운/NNG
1093,제작진/NNG 부랴부랴/MAG 경찰서/NNG (으)로/JKB 달려가/VV
1094,둘/NR 앞/NNG (으)로/JKB 달려가/VV
1095,생선/NNG 가게/NNG (으)로/JKB 가/VV
1096,마이크/NNG 스튜디오/NNG (으)로/JKB 넘기/VV
1097,어디/NP (으)로/JKB 가/VV
1098,윤건/NNP 여관__03/NNG (으)로/JKB 돌아오/VV
1099,분위기/NNG 퇴학/NNG 쪽__05/NNB (으)로/JKB 기울/VV
1100,호야/NNP 마당/NNG 바위__01/NNG (으)로/JKB 나오/VV
1101,이쪽/NP (으)로/JKB 들어오/VV
1102,은색/NNG 바다/NNG 위__01/NNG (으)로/JKB 떠내려가/VV 나무__01/NNG 상자__10/NNG 사람/NNG
1103,무사히__02/MAG 송파/NNP (으)로/JKB 돌려보내/VV 것/NNB
1104,시접__01/NNG 뒷면/NNG (으)로/JKB 넘기/VV 앞쪽/NNG 박음질/NNG
1105,엄마/NNG 새__03/NNG 어디/NP (으)로/JKB 날아가/VV
1106,어머님/NNG 배속/NNG (으)로/JKB 다시/MAG 들어가__01/VV 기분__01/NNG
1107,뒤__01/NNG (으)로/JKB 돌아가/VV
1108,누나/NNG 그거/NP 어디/NP (으)로/JKB 가져가/VV
1109,기자실/NNG (으)로/JKB 부르/VV
1110,어디/NP (으)로/JKB 취재/NNG 가/VV
1111,난데없이/MAG 꼬마/NNG 하나/NR 엄폐호/NNG 속__01/NNG (으)로/JKB 뛰어들/VV
1112,양/NNP 안과__02/NNG (으)로/JKB 가/VV
1113,우리/NP 신문사/NNG (으)로/JKB 가/VV 것/NNB
1114,다음__01/NNG 꿈__01/NNG 속__01/NNG (으)로/JKB 들어가__01/VV
1115,말__01/NNG 사무실/NNG (으)로/JKB 가/VV
1116,사람/NNG 한길__01/NNG (으)로/JKB 나가/VV
1117,엄마/NNG 아빠/NNG 어디/NP (으)로/JKB 가/VV
1118,검찰__02/NNG (으)로/JKB 송치__04/NNG 면회__02/NNG 되__01/VV
1119,은철/NNP 역시/MAG 정면__01/NNG (으)로/JKB 쏘__01/VV
1120,보리밭/NNG 뒷골목/NNG (으)로/JKB 들어가__01/VV
1121,그러면/MAJ 이제/MAG 자연__01/NNG 현상__04/NNG (으)로/JKB 관심__01/NNG 돌리__04/VV
1122,어느덧/MAG 산엉덩이/NNG 왼편/NNG 뒤__01/NNG (으)로/JKB 물러나/VV
1123,뼁끼통/NNG 옆/NNG (으)로/JKB 찌그러지/VV
1124,그러나/MAJ 민재/NNP 몇/NR 걸음/NNG 더/MAG 앞/NNG (으)로/JKB 나가/VV
1125,그리고/MAJ 조금/MAG 후__08/NNG 사람/NNG 조사실/NNG (으)로/JKB 가/VV
1126,품이/NNP 그쪽/NP (으)로/JKB 눈길__01/NNG 돌리__04/VV
1127,남편__01/NNG 책상__01/NNG 앞/NNG (으)로/JKB 빼__01/VV
1128,근데/MAJ 얘/NP 또/MAG 어디/NP (으)로/JKB 가/VV
1129,내부__04/NNG (으)로/JKB 눈__01/NNG 돌리__04/VV
1130,그러나/MAJ 그/NP 곧장/MAG 저승/NNG (으)로/JKB 가/VV 것/NNB
